SicilNo;Birim;Mudurluk;Amac;Yetki;AnaSorumluluk;ad_soyad
005689;TICARI ARAÇLAR YEDEK PARÇA SATIS TAKIMI;TA GLOBAL SSH VE YEDEK PARÇA LIDERLIGI;"Satis hedeflerinin gerçeklestirilerek karliligin arttirilmasini saglamak.
Müsteri memnuniyeti ve hizmet kalitesini arttirmak.";Alinan kararlarin sirket politikalarina uygun olmasi ve üst yönetime raporlanmasi ayrica istatistiki bilgiler sunarak yönetimin karar alma sürecini hizlandirmak ve kolaylastirmak;" 1. Garaj organizasyonu garajla  ilgili belirtilen standartlarin uygulugu saglamak ve denetlemek garajda minimum seviyede yedek parça stoklamasini yapmak servis hizmetini yapmak., 2. Garajda degistirilen parçalarin claim raporlarini olusturmak ve olusan arizalarla ilgili sirket departmanlarini raporlar yayinlayarak bilgilendirmek., 3. Müsteri sikayet ve ariza istatistiklerini raporlamak ve yayinlamak., 4. Servis ve satis sonrasi ile ilgili mevzuati izlemek ve faaliyetlerin uygunlugunu saglamak., 5. Bölüm çalisanlarini hedefler dogrultusunda yönlendirmek gelisimlerini planlamak ve desteklemek., 6. Egitim organizasyonuIETT söförlerine  araci tanitmak ve kullanim tarzini belirtmek., 7. 24 saat vardiya sisteminin yürütülmesini ve organizasyonunu gezici servis hizmetinin verilmesini saglamak., 8. Sorumluluk alanindaki çalismalarin is güvenligi kurallarina uygun yapilmasini saglamak tespit edilen uygunsuzluklari kapatmak ve risk degerlendirmelerinin güncelligini saglamak için ISG Birimi ile birlikte çalismak., 9. Sorumluluk alaninda meydana gelen is kazalarinin analiz edilip kazalarin tekrarlamamasi ve gerekli önlemlerin alinmasi için  Üretim ve Tesis Mühendislik ISG Birimi ve ilgili birimler  ile birlikte çalismak.,  1. Garaj organizasyonu garajla  ilgili belirtilen standartlarin uygulugu saglamak ve denetlemek garajda minimum seviyede yedek parça stoklamasini yapmak servis hizmetini yapmak., 2. Garajda degistirilen parçalarin claim raporlarini olusturmak ve olusan arizalarla ilgili sirket departmanlarini raporlar yayinlayarak bilgilendirmek., 3. Müsteri sikayet ve ariza istatistiklerini raporlamak ve yayinlamak., 4. Servis ve satis sonrasi ile ilgili mevzuati izlemek ve faaliyetlerin uygunlugunu saglamak., 5. Bölüm çalisanlarini hedefler dogrultusunda yönlendirmek gelisimlerini planlamak ve desteklemek., 6. Egitim organizasyonuIETT söförlerine  araci tanitmak ve kullanim tarzini belirtmek., 7. 24 saat vardiya sisteminin yürütülmesini ve organizasyonunu gezici servis hizmetinin verilmesini saglamak., 8. Sorumluluk alanindaki çalismalarin is güvenligi kurallarina uygun yapilmasini saglamak tespit edilen uygunsuzluklari kapatmak ve risk degerlendirmelerinin güncelligini saglamak için ISG Birimi ile birlikte çalismak., 9. Sorumluluk alaninda meydana gelen is kazalarinin analiz edilip kazalarin tekrarlamamasi ve gerekli önlemlerin alinmasi için  Üretim ve Tesis Mühendislik ISG Birimi ve ilgili birimler  ile birlikte çalismak.,  1. Garaj organizasyonu garajla  ilgili belirtilen standartlarin uygulugu saglamak ve denetlemek garajda minimum seviyede yedek parça stoklamasini yapmak servis hizmetini yapmak., 2. Garajda degistirilen parçalarin claim raporlarini olusturmak ve olusan arizalarla ilgili sirket departmanlarini raporlar yayinlayarak bilgilendirmek., 3. Müsteri sikayet ve ariza istatistiklerini raporlamak ve yayinlamak., 4. Servis ve satis sonrasi ile ilgili mevzuati izlemek ve faaliyetlerin uygunlugunu saglamak., 5. Bölüm çalisanlarini hedefler dogrultusunda yönlendirmek gelisimlerini planlamak ve desteklemek., 6. Egitim organizasyonuIETT söförlerine  araci tanitmak ve kullanim tarzini belirtmek., 7. 24 saat vardiya sisteminin yürütülmesini ve organizasyonunu gezici servis hizmetinin verilmesini saglamak., 8. Sorumluluk alanindaki çalismalarin is güvenligi kurallarina uygun yapilmasini saglamak tespit edilen uygunsuzluklari kapatmak ve risk degerlendirmelerinin güncelligini saglamak için ISG Birimi ile birlikte çalismak., 9. Sorumluluk alaninda meydana gelen is kazalarinin analiz edilip kazalarin tekrarlamamasi ve gerekli önlemlerin alinmasi için  Üretim ve Tesis Mühendislik ISG Birimi ve ilgili birimler  ile birlikte çalismak., Teknik sartnamalerin incelenmesi ve ön hazirlik çalismalarinin yapilmasi, Servis ekipman ihtiyaç listelerinin çikartilarak temin edilmesi, Ihtiyaç duyulan sistem alt yapi programinin hazirlanmasi, Müdürlüge bagli tüm özel projelere (Romanya – IETT- Merkez Servis) teknik destek ve SAP projelerine dahil olarak projelere kazanç saglamak, Sözlesme kapsaminda alt yüklenicilere yaptirilan is süreçlerinin kontrol ve takiplerinin yapilarak raporlamak., 7/24 saat vardiya sisteminin yürütülebilmesi için organizasyonu ve mobil gezici servis hizmetinin verilmesini saglamak,  Garaj organizasyonu garajla  ilgili belirtilen standartlarin uygulugu saglamak ve denetlemek garajda minimum seviyede yedek parça stoklamasini yapmak servis hizmetini yapmak., Müsteri sikayet ve ariza istatistiklerini raporlamak ve yayinlamak., Bölüm çalisanlarini hedefler dogrultusunda yönlendirmek gelisimlerini planlamak ve desteklemek., Egitim organizasyonuIETT söförlerine  araci tanitmak ve kullanim tarzini belirtmek., 24 saat vardiya sisteminin yürütülmesini ve organizasyonunu gezici servis hizmetinin verilmesini saglamak., Sorumluluk alanindaki çalismalarin is güvenligi kurallarina uygun yapilmasini saglamak tespit edilen uygunsuzluklari kapatmak ve risk degerlendirmelerinin güncelligini saglamak için ISG Birimi ile birlikte çalismak., Sorumluluk alaninda meydana gelen is kazalarinin analiz edilip kazalarin tekrarlamamasi ve gerekli önlemlerin alinmasi için  Üretim ve Tesis Mühendislik ISG Birimi ve ilgili birimler  ile birlikte çalismak., Teknik sartnamalerin incelenmesi ve ön hazirlik çalismalarinin yapilmasi, Servis ekipman ihtiyaç listelerinin çikartilarak temin edilmesi, Sözlesme kapsaminda alt yüklenicilere yaptirilan is süreçlerinin kontrol ve takiplerinin yapilarak raporlamak., 7/24 saat vardiya sisteminin yürütülebilmesi için organizasyonu ve mobil gezici servis hizmetinin verilmesini saglamak, • Satis hedeflerini belirlemek ve bu hedeflere ulasmak için stratejiler olusturmak, • Rakip analizi yapmak ve müsteri taleplerini takip etmek, • Yedek parça satislarini arttirmak yeni müsterileri portföye kazandirmak, • Siparisleri takip etmek teklif olusturmak ve müsteri siparislerini islemek, • Servis ve yedek parça faaliyetleri için üretici firma ve bayiler arasinda iletisimi saglamak, • Rakip firmalari takip etme ve fiyat analizleri yapmak, • Yedek parça bulunabilirligininbspsaglamak, • Müsteri memnuniyetini saglamak ve hizmet kalitesini arttirmak, • Satis raporlari hazirlamak, Çevik çalisma metodolojisinin gerekliliklerinin (daily, sprint planlama, review vb.) yerine getirilmesini saglamak., ";MEHMET YILDIZ
006036;TA SSH & YP TEKNIK MÜK MERKEZI LIDERLIGI;TA SSH & YP TEKNIK MÜK MERKEZI LIDERLIGI;Otokar’da üretilen ticari araçlar için yurtdisi satis sonrasi hizmetlerinin verilmesi.;Birim Yöneticisinin onay ve yönlendirmesi dahilinde çalisir.;" 1. Müsterilerden gelen sikayet ve talepler dogrultusunda araçlarla ilgili problem ve hasaarlarin giderilmesini saglamak, 2. Servis hizmetleriyle ilgili her türlü konuda müsteri iliskilerini (müsteri sikayet ve talepleri) yürütmek., 3. Servisin haftalik ve aylik faaliyet raporlarini Istanbul Servisler Koordinatörüne sunmak., 4. Ön muhasebe ve stok envanter takibi ve tedarikini yapmak., 5. Garanti islemleri Otokar GOS sisteme girmek (S.S.H.B), 6. Kasa islemlerinin takibi ve yürütülmesi, 7. Servisin disari ile ilgili faaliyetlerinin yürütülmsei, 1. Yurtdisi bayilerin satis sonrasi sistemini kurmalarina yardimci olmak., 2. Satis Sonrasi sistemin planli bir sekilde uygulanmasini saglamak izlemek ve aksayan yönlerini düzeltmek., 3. Yurtdisi araçlarda yasanan sorunlarin çözülmesine yardimci olmak bayilerin ve servislerin çözemedigi sorunlarda teknik ekiple seyahat ederek sorunun çözülmesini saglamak., 4. Yurtdisi bayi servisleri denetlemek incelemek., 5. Garanti giderlerinin düsmesini saglamak., 6. Otokar dis satislarin artmasina paralel olarak yeni servis yapilandirilmasi faaliyetlerinin devamligini kontrol etmek ve yürütmek., 7. Yeni türev motorlarin Avrupa araçlarindaki idamesini ve bakimlarini yapmak., 8. Ihalalerdeki satis sonrasi konulari ile ilgili çalismalar yapmak (Araç bakim maliyetleri baslangiç stok listelerinin hazirlanmasi)., 9. Teknik seyahatler esnasinda araçlarda tespit edilen aksakliklarin raporlanmasi ve ilgili birimlere bildirilmesi., 10. Fabrika düzeyinde servis hizmeti vermek ve isinin gerektirdigi yurtiçi ve yurtdisi seyahatlari planlamak ve yapmak, 11. Servislerde minimum yedek parça stok seviyelerini belirlemek PDI periyodik bakim formlarinin olusturulmasini saglamak., 12.Özel takimlarin ve Diagnostiklerin araç ve komponent bazinda belirlemek YPOS sistemine tanitmak tedarigi ve servislere temini süreçlerine destek verilmesini saglamak., 13.Müsteri ziyaretleri yaparak müsteri görüs ve sikayetlerini ilgili bölümlere raporlamak araçlarin gelistirilmesine katkida bulunulmasini saglamak., 14. Ar-Ge tarafindan onaylanan ve devreye girmesi planlanan yeni parçalarin Saha Testlerini yapmak ve sonuçlarini raporlanmasini saglamak., 15. Servis ve satis sonrasi ile ilgili mevzuati izlemek ve faaliyetlerin uygunlugunu saglamak., 16. Rakipler hakkinda edinilen bilgileri Satis ve Mühendislik departmanlariyla paylasarak araçlarimizin pazardaki rakiplere göre konumu konusunda bilgilerin aktarilmasinin saglanmasi, 17.Yeni projelerin Satis Sonrasi Hizmetler yönünden hazirlik süreçlerinin yönetilmesi ve araç lanse edildiginda yedek parça servis yapilandirma egitim v.b. faaliyetlerin tamamlanmasini saglamak suretiyle projenin basarili olmasina katki saglanmasi, 1. Yurtdisi bayilerin satis sonrasi sistemini kurmalarina yardimci olmak., 2. Satis Sonrasi sistemin planli bir sekilde uygulanmasini saglamak izlemek ve aksayan yönlerini düzeltmek., 3. Yurtdisi araçlarda yasanan sorunlarin çözülmesine yardimci olmak bayilerin ve servislerin çözemedigi sorunlarda teknik ekiple seyahat ederek sorunun çözülmesini saglamak., 4. Yurtdisi bayi servisleri denetlemek incelemek., 5. Garanti giderlerinin düsmesini saglamak., 6. Otokar dis satislarin artmasina paralel olarak yeni servis yapilandirilmasi faaliyetlerinin devamligini kontrol etmek ve yürütmek., 7. Yeni türev motorlarin Avrupa araçlarindaki idamesini ve bakimlarini yapmak., 8. Ihalalerdeki satis sonrasi konulari ile ilgili çalismalar yapmak (Araç bakim maliyetleri baslangiç stok listelerinin hazirlanmasi)., 9. Teknik seyahatler esnasinda araçlarda tespit edilen aksakliklarin raporlanmasi ve ilgili birimlere bildirilmesi., 10. Fabrika düzeyinde servis hizmeti vermek ve isinin gerektirdigi yurtiçi ve yurtdisi seyahatlari planlamak ve yapmak, 11. Servislerde minimum yedek parça stok seviyelerini belirlemek PDI periyodik bakim formlarinin olusturulmasini saglamak., 12.Özel takimlarin ve Diagnostiklerin araç ve komponent bazinda belirlemek YPOS sistemine tanitmak tedarigi ve servislere temini süreçlerine destek verilmesini saglamak., 13.Müsteri ziyaretleri yaparak müsteri görüs ve sikayetlerini ilgili bölümlere raporlamak araçlarin gelistirilmesine katkida bulunulmasini saglamak., 14. Ar-Ge tarafindan onaylanan ve devreye girmesi planlanan yeni parçalarin Saha Testlerini yapmak ve sonuçlarini raporlanmasini saglamak., 15. Servis ve satis sonrasi ile ilgili mevzuati izlemek ve faaliyetlerin uygunlugunu saglamak., 16 .Yeni projelerin Satis Sonrasi Hizmetler yönünden hazirlik süreçlerinin yönetilmesi ve araç lanse edildiginda yedek parça servis yapilandirma egitim v.b. faaliyetlerin tamamlanmasini saglamak suretiyle projenin basarili olmasina katki saglanmasi, Çevik çalisma metodolojisinin gerekliliklerinin (daily, sprint planlama, review vb.) yerine getirilmesini saglamak., ";KEREM KARTER
006090;TA STR PROJ TEKLIF VE PROG YÖN TAKIMI;TA IS GELISTIRME VE PAZARLAMA LIDERLIGI;"Program Yöneticisi sözlesme imzalandiktan yada kesin siparisi geçildikten sonra Program Yönetimi kapsaminda süreçleri yürütülecek ihalelerin çapraz matris organizasyonlu bir yapida yönetilmesi için terekli prosedürleri izlemek ve genel koordinasyonu saglamayi amaçlar. ";"Yönetici onay ve yönlendirmesi Ilgili prosedür ve talimatlar TSE Standardi BLS Standardi DIN Standardi
AITM (araç imalat tadilat montaj) Yönetmeligi ve Motorlu Araçlar Tip Onay Yönetmeligi çerçevesinde çalisir.
";" 1. Ürün Gelistirme (Ticari ve Askeri) Müdürlügü kapsaminda sirket ürün gamina girecek araçlarin sasi grubu parçalarinin tasarim mühendislik hesaplari prototip çalismalarini yürütmek ve bunlarla ilgili test çalismalarini gözlemlemek projelendirmek ve, , 2. Ürün Gelistirme (Ticari ve Askeri) Müdürlügü kapsaminda sirket ürün gaminda yer alan araçlarin sasi grubu parçalarini iyilestirme çalismalari kapsaminda  tasarim mühendislik hesaplari prototip çalismalarini yürütmek ve bunlarla ilgili test çalisma, 3. Yeni ürün gelistirme yada iyilestirme projeleri ile ortaya çikan ürünlerle ilgili sapma taleplerini incelemek ve sapma azaltici tedbirlerin alinmasini saglamak, 4. AB uyum sürecindeki araç tip onayi regülasyon direktifler ile ilgili uygunluk tespitinin ve Sanayi Ticaret Bakanliginin Resmi Gazetede yayinlanan araçlarin uymasi gereken kural ve sartlarin içerigini Ürün Projeleri Tasarim ve Güvence Biriminden te, 5. Yeni araçlarin sasi bölümü için sistem bazinda detay parçalari sartnamelerinin ve uluslararasi standartlarin incelenmesi ön arastirma yapilmasi., 6. Prototip araçtaki parçalarin testi amaciyla yol ve km. kosulunun belirlenmesi arizalanan parçalarin iyilestirilmesi yeterli testin yapildigina karar verilmesi. Seri üretime hazirlanilmasi., 7.  Parçalarin seri üretim için yayinlanirken imalatçinin ve kalite biriminin yapacagi test malzeme ve kaplama bilgisinin imalat ölçülerinin eksiksiz oldugunun kontrol edilmesi  Ön seriye gelen parçalarin sapma istegi varsa incelenip uygunluk kararin, 8. Ar-ge kapsaminda yeni ürünlerle ilgili fuarlarda internette servislerde inceleme yapilip raporlanmasi. Seri üretimi devam eden parçalarda yerlilestirme ve ucuzlatma yapilmasi.,  1. Sehiriçi Sistem Mühendisligi Müdürlügü kapsaminda sirket ürün gamina girecek araçlarin mühendislik hesaplari prototip çalismalarini yürütmek ve bunlarla ilgili test çalismalarini gözlemlemek projelendirmek ve tamamlamak., 2. Sehiriçi Sistem Mühendisligi Müdürlügü kapsaminda sirket ürün gamina /span nbspyer alan araçlarin iyilestirme çalismalari kapsaminda  tasarim mühendislik hesaplari prototip çalismalarini yürütmek ve bunlarla ilgili test çalisma yapilmasi, 3. Yeni ürün gelistirme yada iyilestirme projeleri ile ortaya çikan ürünlerle ilgili sapma taleplerini incelemek ve sapma azaltici tedbirlerin alinmasini saglamak, 4. AB uyum sürecindeki araç tip onayi regülasyon direktifler ile ilgili uygunluk tespitinin ve Sanayi Ticaret Bakanliginin Resmi Gazetede yayinlanan araçlarin uymasi gereken kural ve sartlarin içerigini Ürün Projeleri Tasarim ve Güvence Biriminden te, 5. Yeni araçlarin sasi bölümü için sistem bazinda detay parçalari sartnamelerinin ve uluslararasi standartlarin incelenmesi ön arastirma yapilmasi., 6. Prototip araçtaki parçalarin testi amaciyla yol ve km. kosulunun belirlenmesi arizalanan parçalarin iyilestirilmesi yeterli testin yapildigina karar verilmesi. Seri üretime hazirlanilmasi., 7.  Parçalarin seri üretim için yayinlanirken imalatçinin ve kalite biriminin yapacagi test malzeme ve kaplama bilgisinin imalat ölçülerinin eksiksiz oldugunun kontrol edilmesi  Ön seriye gelen parçalarin sapma istegi varsa incelenip uygunluk kararin, 8. Ar-ge kapsaminda yeni ürünlerle ilgili fuarlarda internette servislerde inceleme yapilip raporlanmasi. Seri üretimi devam eden parçalarda yerlilestirme ve ucuzlatma yapilmasi., Sorumluluk alanindaki çalismalarin Kalite Çevre Enerji Bilgi Güvenligi Is Sagligi ve Güvenligi ile iligli talimat ve kurallara uygun yapilmasini ilgili birimler ile koordineli olarak gerekli risk önleyici tedbirlerin alinmasini ve gelisimini yönetmek, Program sürecince genel koordinasyonu saglamak., Program icra eden bölümlerin zaman kapsam ve bütçeye uyumunu takip etmek raporlamak., Milestone toplantilarini düzenlemek ve bölümlerin kendi sorumluluk alanindaki konulari ve KPIlarini TA GMYye düzenli sunulmasini koordine etmek., Bölümlerden gelecek bölüm KPIlari konsolide etmek ve üst yönetim dahil herkese açik bir sekilde yayinlamak., Satis ve diger ekiplerle müsteriden gelen yeni kapsam degisikliklerini koordine eder., Adreslenen aksiyonlari tüm ekip ve bölüm yöneticilerine dagitir., Sorumluluk alanindaki çalismalarin Kalite Çevre Enerji Bilgi Güvenligi Is Sagligi ve Güvenligi ile iligli talimat ve kurallara uygun yapilmasini ilgili birimler ile koordineli olarak gerekli risk önleyici tedbirlerin alinmasini ve gelisimini yönetmek, Program sürecince genel koordinasyonu saglamak., Program icra eden bölümlerin zaman kapsam ve bütçeye uyumunu takip etmek raporlamak., Milestone toplantilarini düzenlemek ve bölümlerin kendi sorumluluk alanindaki konulari ve KPIlarini TA GMYye düzenli sunulmasini koordine etmek., Bölümlerden gelecek bölüm KPIlari konsolide etmek ve üst yönetim dahil herkese açik bir sekilde yayinlamak., Satis ve diger ekiplerle müsteriden gelen yeni kapsam degisikliklerini koordine eder., Adreslenen aksiyonlari tüm ekip ve bölüm yöneticilerine dagitir., Çevik çalisma metodolojisinin gerekliliklerinin (daily, sprint planlama, review vb.) yerine getirilmesini saglamak., ";MUSTAFA SEFA BURHAN
006382;TA SSH & YP SAT LID - TR & ÇEVRE ÜLKELER;TA GLOBAL SSH VE YEDEK PARÇA LIDERLIGI;Türkiye ve Çevre Ülkeler yedek parça satis sürecinin yönetimi;"Türkiye ve Çevre Ülkeler SSH ve Yedek Parça Satis Onay Ve Yönlendirmesi Dogrultusunda Çalisir

";" Servis egitim ihtiyaç planlarinin çikarilmasi ve uygulanmasi konularinda görüs bildirmek, Servislerin genel özel alet ve cihazlarinin tespiti servis ve ilgili birimlere bildirimi, Yeni ürünlerin devreye girisinde ve ihtiyaç durumunda gerekli egitimlerin yurt içi ve yurt disi tedarikçilerden alinmasi, Kampanyalarin servislerde uygulamasinin takip edilmesi kampanya siparislerinin kontrol edilmesi kampanya parçalarinin stok kontrolü denetleme ve raporlamalarin yapilmasi, Bölgedeki müsterilerin ziyaret edilmesine destek verilmesi  aktarilan müsteri talep ve beklentilerinin ilgili birimlere raporlanmasi, Bölge Servisleri ve müsteriler arasindaki iliskilerin denetlenmesi degerlendirilmesi ve servisler hakkinda raporlama yapilmasi, Yeni servis açilmasinda servis yapilandirma ve dereye alma süreçlerinin takibi veya farkli araç girislerinde yedek parça ile ilgili tedarik konularinin ilgili birimlere aktarilmasi, Bölge servislerine gerekli teknik destegin verilmesi, Otokar garanti prosedürünün sahada uygulanmasi ve servis ziyaretleri sirasinda kleym parçalarin Örnekleme Metodu ile kontrollerinin yapilmasi, .Servislerin belli periyodlar dahilinde ( yilda en az 2 ) islevsel   denetlemelerinin yapilmasi ve ilgili birimlere raporlanmasi., 11. ISO 10002 Müsteri Sikayetlerinin Ele Alinmasi Yönetim   Sistemi ile ilgili faaliyetler için Müsteri Iliskileri Birimine destek vermek,  Servis egitim ihtiyaç planlarinin çikarilmasi ve uygulanmasi konularinda görüs bildirmek, Servislerin genel özel alet ve cihazlarinin tespiti servis ve ilgili birimlere bildirimi, Yeni ürünlerin devreye girisinde ve ihtiyaç durumunda gerekli egitimlerin yurt içi ve yurt disi tedarikçilerden alinmasi, Kampanyalarin servislerde uygulamasinin takip edilmesi kampanya siparislerinin kontrol edilmesi kampanya parçalarinin stok kontrolü denetleme ve raporlamalarin yapilmasi, Bölgedeki müsterilerin ziyaret edilmesine destek verilmesi  aktarilan müsteri talep ve beklentilerinin ilgili birimlere raporlanmasi, Bölge Servisleri ve müsteriler arasindaki iliskilerin denetlenmesi degerlendirilmesi ve servisler hakkinda raporlama yapilmasi, Yeni servis açilmasinda servis yapilandirma ve dereye alma süreçlerinin takibi veya farkli araç girislerinde yedek parça ile ilgili tedarik konularinin ilgili birimlere aktarilmasi, Bölge servislerine gerekli teknik destegin verilmesi, Otokar garanti prosedürünün sahada uygulanmasi ve servis ziyaretleri sirasinda kleym parçalarin Örnekleme Metodu ile kontrollerinin yapilmasi, .Servislerin belli periyodlar dahilinde ( yilda en az 2 ) islevsel   denetlemelerinin yapilmasi ve ilgili birimlere raporlanmasi., 11. ISO 10002 Müsteri Sikayetlerinin Ele Alinmasi Yönetim   Sistemi ile ilgili faaliyetler için Müsteri Iliskileri Birimine destek vermek,  Servis egitim ihtiyaç planlarinin çikarilmasi ve uygulanmasi konularinda görüs bildirmek, Servislerin genel özel alet ve cihazlarinin tespiti servis ve ilgili birimlere bildirimi, Yeni ürünlerin devreye girisinde ve ihtiyaç durumunda gerekli egitimlerin yurt içi ve yurt disi tedarikçilerden alinmasi, Kampanyalarin servislerde uygulamasinin takip edilmesi kampanya siparislerinin kontrol edilmesi kampanya parçalarinin stok kontrolü denetleme ve raporlamalarin yapilmasi, Bölgedeki müsterilerin ziyaret edilmesine destek verilmesi  aktarilan müsteri talep ve beklentilerinin ilgili birimlere raporlanmasi, Bölge Servisleri ve müsteriler arasindaki iliskilerin denetlenmesi degerlendirilmesi ve servisler hakkinda raporlama yapilmasi, Yeni servis açilmasinda servis yapilandirma ve dereye alma süreçlerinin takibi veya farkli araç girislerinde yedek parça ile ilgili tedarik konularinin ilgili birimlere aktarilmasi, Bölge servislerine gerekli teknik destegin verilmesi, Otokar garanti prosedürünün sahada uygulanmasi ve servis ziyaretleri sirasinda kleym parçalarin Örnekleme Metodu ile kontrollerinin yapilmasi, .Servislerin belli periyodlar dahilinde ( yilda en az 2 ) islevsel   denetlemelerinin yapilmasi ve ilgili birimlere raporlanmasi., 11. ISO 10002 Müsteri Sikayetlerinin Ele Alinmasi Yönetim   Sistemi ile ilgili faaliyetler için Müsteri Iliskileri Birimine destek vermek, Yillik ciro ve karlilik hedefleri dogrultusunda Yedek parça Ciro ve Madeni Yag Satis hedeflerinin yakalanmasi için gerekli aksiyonlari planlamak ve icra etmek,  • Yedek parça bayileri ve servis iliskilerimizi düzenlemek., • Yedek parça kampanya çalismalari hazirlik analiz evreye alis izleme raporlama ve kampanya sonrasi yapilacak aksiyonlarin belirlenmesi ve takibinin yapilmasi, • Atil stoklarin degerleme çalismalarinda bulunmak, • Aylik yillik raporlar, • Stratejik Ciro Raporunbsp, • Türkiye ve çevre ülkeler yedek parça satis hedeflerinin takibi raporlanmasi yönlendirilmesi, • Yillik Planli/Terminli siparis çalismalarini gerçeklestirmek, • Benchmark analizlerinin yapilmasi, • Alicinin gerektiginde yedek parça kabul muayenelerinde bulunmak, • Yetkili servis ve bayilerden gelen ACIL siparislerin izlenmesi ve aksayan yönlerin iyilestirilmesi., • Performans dagitim sistemi çalismalari devreye alinmasi takibi, Çevik çalisma metodolojisinin gerekliliklerinin (daily, sprint planlama, review vb.) yerine getirilmesini saglamak., ";SERHAT ÇABUK
006499;SATIS SONRASI LOJISTIK TAKIMI;GLOBAL SATIS SONRASI TEDARIK ZINCIRI LID;"Otokar Yedek Parçalarinin tedarik ve satis sürecinin yönetimi ";Departman yöneticisinin onay ve yetkilendirmesi dogrultusunda çalisir.;" Yurtdisi Bakiye Takibi, Ihraç Edilen Tüm parçalar için mense gtip ve beyanname çalismalari., Kayit Düzeltme Islemleri, Opet Fuch Fatura Girisleri, Cummins Yazilim Bedeli Faturalar, Müsteri Iade Fatura Girisleri,  Yiçi ve Yurtdisi Bakiye Takibi, Ihraç Edilen Tüm parçalar için mense gtip ve beyanname çalismalari., Kayit Düzeltme Islemleri, Opet Fuch Fatura Girisleri, Müsteri Iade Fatura Girisleri, • Yatan araçlarin raporlanmasi. Yakin takibi. SSH ile düzenli is gelistirme., Çevik çalisma metodolojisinin gerekliliklerinin (daily, sprint planlama, review vb.) yerine getirilmesini saglamak., ";SIBEL YAVUZ SAHINOGLU
