SicilNo;Birim;Mudurluk;Amac;Yetki;AnaSorumluluk;ad_soyad
003356;YOLCU GRUBU YURT DISI SATIS LIDERLIGI;YOLCU GRUBU YURT DISI SATIS LIDERLIGI;Sirketçe Tespit Edilen Ihracat Hedeflerine Ulasabilmesi Yönünde sorumlu oldugum bölgede ticari Araçlar Satis Ve Faaliyetlerinin Yürütülmesi.;"Yöneticisinin yönlendirmesi ile çalisir
";" 1. Ihracat ile ilgili fiyat hesaplanmalarini yapmak teklif vermek ve bununla bagintili olarak temas ve yazismalari yürütmek takibatini yapmak., Yabanci heyetleri karsilamak agirlamak ve temas programini gerçeklestirmek, 2. Ihracat konusunda devlet daireleri ile ilgili temaslari yürütmek ve gerekli islemlerin takibatini yapmak., 3. Ihrac edilecek mallarin ambalajlanma sevk öncesi nakliye ve diger hazirliklari organize etmek, 4. Mal bedelleri vebenzeri tahsilat islemlerini yürütmek vesaik düzenlemek ve ilgili  yerlere intikal ettirmek,  Yabanci heyetleri karsilamak agirlamak ve temas programini gerçeklestirmek, 3. Ihrac edilecek mallarin ambalajlanma sevk öncesi nakliye ve diger hazirliklari organize etmek, 4. Mal bedelleri vebenzeri tahsilat islemlerini yürütmek vesaik düzenlemek ve ilgili  yerlere intikal ettirmek, 5. Ihracat ve diger yurt disi faaliyetlerle ilgili olarak ihraç malzemelerin sartlarini dis firmalarla müzakeresini yürütmek teklifler sunmak sözlesmeler düzenlemek  ve takibatini yapmak., 6. Yurt disinda olusturulacak acentelik ve bayiliklere iliskin esaslari düzenlemek ve temaslari yürütmek., 7. Ihracat fiyatlarinin tespitine yönelik pazar ve pazardaki rakip ürünler ilgili arastirmalar yapmak., 8. Dis ticaret islemleriyle ilgili mevzuati takip etmek ihracatla ilgili kamu kuruluslariyla temaslari yürütmek ve sorumlu oldugu pazarlarla üst yönetimin ihtiyaç duyacagi verilerin düzenlenmesini saglamak ve raporlamak.,  abanci heyetleri karsilamak agirlamak ve temas programini gerçeklestirmek, . Ihrac edilecek mallarin ambalajlanma sevk öncesi nakliye ve diger hazirliklari organize etmek, . Mal bedelleri vebenzeri tahsilat islemlerini yürütmek vesaik düzenlemek ve ilgili  yerlere intikal ettirmek, . Ihracat ve diger yurt disi faaliyetlerle ilgili olarak ihraç malzemelerin sartlarini dis firmalarla müzakeresini yürütmek teklifler sunmak sözlesmeler düzenlemek  ve takibatini yapmak., . Yurt disinda olusturulacak acentelik ve bayiliklere iliskin esaslari düzenlemek ve temaslari yürütmek., . Ihracat fiyatlarinin tespitine yönelik pazar ve pazardaki rakip ürünler ilgili arastirmalar yapmak., . Dis ticaret islemleriyle ilgili mevzuati takip etmek ihracatla ilgili kamu kuruluslariyla temaslari yürütmek ve sorumlu oldugu pazarlarla üst yönetimin ihtiyaç duyacagi verilerin düzenlenmesini saglamak ve raporlamak., KVK Is Birim Sorumlusu sifatiyla Otokar Avrupa Sirket Müdürlügü ait KVK envanteri ve süreçlerini yönetmek Sirketin KVK politika ve prosedürlerini uygulamak KVK Proje Ekibi ile koordineli olarak gerekli risk önleyici tedbirlerin alinmasini ve gelisimini saglamak.,  • Sorumlu oldugum bölgede ticari araçlar dis temel politika strateji ve hedeflerini belirlemeksatis ile ilgili kisa ve uzun vadeli planlari hazirlamak ve uygulanmasini saglamak, • Sorumlu oldugum dis pazarlardaki müsteri ihtiyaçlarini algilamak çözüm üretmek müsteriye özel esnek satis yöntemleri gelistirmek uzun vadeli ve sürdürülebilir iliskiye yönelik fiyat politikalari olusturmak ve uygulamak, • Yurt disi pazarda satis kanallarini belirleyici çalismalar yapmak olusturulacak acentalik ve bayiliklere iliskin esaslari düzenlemek temaslari yürütmek ve bayi stok ve alacak riskini yönetmek, • Sorumlu oldugum bölgede mevcut müsteri ve bayi iliskilerinin sürekliligini saglamak gelistirmek pazar ve müsteriler hakkindaki bilgilerin güncel tutulmasi faaliyetlerini yönetmek, • Sorumlu oldugum ihalelere katilimda teklif sürecini yönetmek, • Bagli çalisanlarinin kisisel ve mesleki gelisimi ile yetkinliklerinin artirilmasina yönelik çalismalarin programlamak ve izlemek, • Dis ticaret islemleriyle ilgili mevzuati takip etmek ihracatla ilgili kamu kuruluslariyla temaslari yürütmek ve üst yönetimin ihracatla ilgili ihtiyaç duyacagi verilerin düzenlenmesini saglamak, Çevik çalisma metodolojisinin gerekliliklerinin (daily, sprint planlama, review vb.) yerine getirilmesini saglamak., ";ONUR ÖNER
003397;SATIS SONRASI LOJISTIK TAKIMI;GLOBAL SATIS SONRASI TEDARIK ZINCIRI LID;"Otokar Yedek Parçalarinin tedarik ve satis sürecinin yönetimi ";Departman yöneticisinin onay ve yetkilendirmesi dogrultusunda çalisir.;" Yedek Parça Depo sorumlusu olarak yetkli alanima tabi tüm personelin izinistirahat takibi, Personelin performans degerlendirmesi ve puanlanmasi, Personellerin birebir takibi ve is olan  motivasyonu yükseltmek, Yedek parçalarin standarta uygun sekilde paketlenmesinin denetlenmesi ve gerekli durumlarda teknolojik imkanlardan faydalanmak maksatli arastirmalar yapip eksikliklerin üst yönetime bildirilmesi, Müsteri sikayetlerini degerlendirme çözüm üretme, Yedek parça makina parkinda kullanilan araçlar ve teçhizatlarin ariza onarim durumunda bakim biriminin servis hizmetinin denetlenmesi gerekli durumlarda müdahalede bulunulmasi,  Yedek Parça Depo sorumlusu olarak yetkli alanima tabi tüm personelin izinistirahat takibi, Personelin performans degerlendirmesi ve puanlanmasi, Personellerin birebir takibi ve is olan  motivasyonu yükseltmek, Yedek parçalarin standarta uygun sekilde paketlenmesinin denetlenmesi ve gerekli durumlarda teknolojik imkanlardan faydalanmak maksatli arastirmalar yapip eksikliklerin üst yönetime bildirilmesi, Müsteri sikayetlerini degerlendirme çözüm üretme, Yedek parça makina parkinda kullanilan araçlar ve teçhizatlarin ariza onarim durumunda bakim biriminin servis hizmetinin denetlenmesi gerekli durumlarda müdahalede bulunulmasi, • Kayit bütünlügü yönetimi ( Sayim ekibi yönetimi ), • Depo içinde belirli periyotlarda 5S  ISG Kontrolleri, Çevik çalisma metodolojisinin gerekliliklerinin (daily, sprint planlama, review vb.) yerine getirilmesini saglamak., ";ALI ERDINÇ DOGRU
003418;TA STR PROJ TEKLIF VE PROG YÖN TAKIMI;TA IS GELISTIRME VE PAZARLAMA LIDERLIGI;Program Yöneticisi sözlesme imzalandiktan yada kesin siparisi geçildikten sonra Program Yönetimi kapsaminda süreçleri yürütülecek ihalelerin çapraz matris organizasyonlu bir yapida yönetilmesi için terekli prosedürleri izlemek ve genel koordinasyonu saglamayi amaçlar.;"Yönetici onay ve yönlendirmesi Ilgili prosedür ve talimatlar TSE Standardi BLS Standardi DIN Standardi
AITM (araç imalat tadilat montaj) Yönetmeligi ve Motorlu Araçlar Tip Onay Yönetmeligi çerçevesinde çalisir.";" • Askeri/Ticari/Paletli araç gelistirme dönemi testlerinin planlanmasi ve gerçeklestirilmesi, • Yeni gelistirilen araçlarda fakli alt sistemlere ait verilerin toplanmasi ve bu verilerin ilgili bölümler ile degerlendirilerek tasarima girdi teskil edecek sekilde raporlanmasi, • Gelistirilen araçlarin sistem ve alt sistem testlerine yönelik ihtiyaç duyulan laboratuarlarin ve test düzeneklerinin tasarimi altyapilarinin çalisilmasi, • Yapisal termal ve titresim testlerinin uygulama planlarinin olusturulmasi, • Askeri/Ticari/Paletli araç gelistirme dönemi NVH testlerinin planlanmasi ve gerçeklestirilmesi, • Titresim ve gürültü testlerinin uygulama planlarinin olusturulmasi, • Gelistirilen araçlarin gürültü ve titresim açisindan optimizasyon çalismalarinin yapilmasi ve bu sistemleri test etmeye yönelik ihtiyaç duyulan ekipman ve yazilim altyapilarinin çalisilmasi, • Askeri/Ticari/Paletli araçlarin yapisal/termal/titresim testleri ile ilgili standartlarin/regülasyonlarin arastirilmasi ve ilgili araçlara uygulanacak sekilde test prosedürlerine dönüstürülmesi,  Askeri/Ticari/Paletli araç gelistirme dönemi saha ve simülasyon testlerinin planlanmasiyürütülmesiverilerin toplanmasidegerlendirilmesi ve raporlanmasi, Klimatik Odada gerçeklestirilen Askeri/Ticari/Paletli araç testlerinin planlanmasiyürütülmesi.Testler sirasinda veri toplama isleminin gerçeklestirilmesitoplanan verilerin degerlendirilmesi ve raporlanmasi., Askeri/Ticari araç ve alt sistem dayaniklilik testleri için gerekli yol verilerinin toplanmasi.Toplanan verilerin Hidrolik Yol Simülatörü (Fourposter) yazilimina aktarilmasi ve sistem üzerinde araç dayaniklilik testlerinin gerçeklestirilmesi., Askeri/Ticari/Paletli araç gelistirme dönemi NVH ile ilgili testlerinin planlanmasi yürütülmesi. Testler sirasinda veri toplama isleminin gerçeklestirilmesitoplanan verilerin degerlendirilmesi ve raporlanmasi, Askeri araç silah kulelerinin 6 eksenli hidrolik simülatör üzerinden test edilmesi için gerekli verilerin toplanmasi.Toplanan verilerin Alti Eksenli Hareket Simülatörü yazilimina aktarilmasi ve sistem üzerinde ilgli testlerin gerçeklestilmesi, Askeri/Ticari/Paletli araç gelistirme dönemi testleri için gerekli ekipman ve yazilim altyapilarinin arastirilmasi güncel teknolojilerin ve yazilimlarin takip edilmesi ve gerekli görülmesi durumunda tedariginin saglanmasi, Askeri/Ticari/Paletli araçlarin yapisal/termal/titresim tesleri ile ilgili standartlarin/regülasyonlarin arastirilmasi ve ilgili araçlara uygulanacak sekilde test prosedürlerinin ve test talimalarinin yazilmasi, Test sistemlerinin periyodik bakim faaliyetlerinin yürütülmesi, Test sistemlerinde meydana gelen arizalarin tesbit edilmesi ve bakim/servis organizasyonunun yapilmasi, Test ekipmanlarinin periyodik olarak kalibrasyonlarinin güncellenmesi için gerekli organizasyonun saglanmasi, Sorumluluk alanindaki çalismalarin ÇevreEnerjiIs sagligi ve Güvenligi ile ilgili talimat ve kurallara uygun yapilmasiilgili birimler ile koordineli olaak gerekli önleyici tedbirlerin alinmasi ve gelisimini saglamak, imatik Odada gerçeklestirilen Askeri/Ticari/Paletli araç testlerinin planlanmasiyürütülmesi.Testler sirasinda veri toplama isleminin gerçeklestirilmesitoplanan verilerin degerlendirilmesi ve raporlanmasi., keri/Ticari/Paletli araç gelistirme dönemi saha ve simülasyon testlerinin planlanmasiyürütülmesiverilerin toplanmasidegerlendirilmesi ve raporlanmasi,  keri/Ticari araç ve alt sistem dayaniklilik testleri için gerekli yol verilerinin toplanmasi.Toplanan verilerin Hidrolik Yol Simülatörü (Fourposter) yazilimina aktarilmasi ve sistem üzerinde araç dayaniklilik testlerinin gerçeklestirilmesi., keri/Ticari/Paletli araç gelistirme dönemi NVH ile ilgili testlerinin planlanmasi yürütülmesi. Testler sirasinda veri toplama isleminin gerçeklestirilmesitoplanan verilerin degerlendirilmesi ve raporlanmasi, keri araç silah kulelerinin 6 eksenli hidrolik simülatör üzerinden test edilmesi için gerekli verilerin toplanmasi.Toplanan verilerin Alti Eksenli Hareket Simülatörü yazilimina aktarilmasi ve sistem üzerinde ilgli testlerin gerçeklestilmesi, keri/Ticari/Paletli araç gelistirme dönemi testleri için gerekli ekipman ve yazilim altyapilarinin arastirilmasi güncel teknolojilerin ve yazilimlarin takip edilmesi ve gerekli görülmesi durumunda tedariginin saglanmasi, keri/Ticari/Paletli araçlarin yapisal/termal/titresim tesleri ile ilgili standartlarin/regülasyonlarin arastirilmasi ve ilgili araçlara uygulanacak sekilde test prosedürlerinin ve test talimalarinin yazilmasi, st sistemlerinin periyodik bakim faaliyetlerinin yürütülmesi, st sistemlerinde meydana gelen arizalarin tesbit edilmesi ve bakim/servis organizasyonunun yapilmasi, st ekipmanlarinin periyodik olarak kalibrasyonlarinin güncellenmesi için gerekli organizasyonun saglanmasi, rumluluk alanindaki çalismalarin ÇevreEnerjiIs sagligi ve Güvenligi ile ilgili talimat ve kurallara uygun yapilmasiilgili birimler ile koordineli olaak gerekli önleyici tedbirlerin alinmasi ve gelisimini saglamak, vresel Test laboratuvarinin TÜRKAK Akreditasyonu kapsaminda ISO 17025 standardina uygun bir sekilde isletilmesini saglamak. Otokar askeri ve ticari araçlarin ve araç alt sistemlerinin Çevresel testlerinin proje planlarina uygun olarak gerçeklestirilmesini saglamak. Dis Müsterilerden gelen talepleri degerlendirmek ve ilgili testlerin planlanmasini yaparak gerçeklestirlmesini saglamak., vresel Test laboratuvarinin (Klimatik Kabin ve Elektrodinamik Sarsici) Otokar proje planlarina uygun bir sekilde isletilmesini saglamak. Otokar askeri ve ticari araç alt sistemlerinin testlerinin proje planlarina uygun olarak gerçeklestirilmesini saglamak. Dis Müsterilerden gelen talepleri degerlendirmek ve ilgili testlerin planlanmasini yaparak gerçeklestirilmesini saglamak, GE Merkezi faaliyetleri kapsaminda test ve dogrulama ile ilgili faaliyetleri planlamak. TEYDEB ve ARGE tesvikleri için yürütülen çalismalara katkida bulunmak., st Merkezinin amaçlarini yerine getirebilmek üzere gerekli organizasyonu olusturmak ve teknik yetkinlige sahip kadrolasmayi saglamak., gimsiz ve güvenilir bir test merkezi olmak için gerekli kural ve yönergelerin olusturulmasi uygulanmasi ve denetlenmesini saglamak., Sorumluluk alanindaki çalismalarin Kalite Çevre Enerji Bilgi Güvenligi Is Sagligi ve Güvenligi ile iligli talimat ve kurallara uygun yapilmasini ilgili birimler ile koordineli olarak gerekli risk önleyici tedbirlerin alinmasini ve gelisimini yönetmek, • Program sürecince genel koordinasyonu saglamak., • Program icra eden bölümlerin zaman kapsam ve bütçeye uyumunu takip etmek raporlamak., • Milestone toplantilarini düzenlemek ve bölümlerin kendi sorumluluk alanindaki konulari ve KPIlarini TA GMYye düzenli sunulmasini koordine etmek., • Bölümlerden gelecek bölüm KPIlari konsolide etmek ve üst yönetim dahil herkese açik bir sekilde yayinlamak., • Satis ve diger ekiplerle müsteriden gelen yeni kapsam degisikliklerini koordine eder., • Adreslenen aksiyonlari tüm ekip ve bölüm yöneticilerine dagitir., Çevik çalisma metodolojisinin gerekliliklerinin (daily, sprint planlama, review vb.) yerine getirilmesini saglamak., ";MURAT TALAY
003692;TA IS GELISTIRME VE PAZARLAMA LIDERLIGI;TA IS GELISTIRME VE PAZARLAMA LIDERLIGI;Otokar markali  yük ve yolcu tasima araçlarini satinalma karari veren müsterilerine uzun ömürlü ve düsük toplam sahip olma maliyeti  saglayan ürün ve hizmetler sunmak ve Otokar Ticari Araçlar Bölümünün hedeflenen büyüme ve karliligini en üst düzeye çikarmasini saglamak.;"
Imza Sirküleri B Grubu Temsil Yetkisi";" 1.	Ticari araçlar dis satis ve pazarlama temel politika strateji ve hedeflerini belirlemek pazarlama ve satis ile ilgili kisa ve uzun vadeli planlari hazirlamak ve uygulanmasini saglamak, 2.	Dis pazarlardaki müsteri ihtiyaçlarini algilamak çözüm üretmek müsteriye özel esnek satis yöntemleri gelistirmek uzun vadeli ve sürdürülebilir iliskiye yönelik fiyat politikalari olusturmak ve uygulamak, 3.	Yurt disi pazarda satis kanallarini belirleyici çalismalar yapmak  olusturulacak acentalik ve bayiliklere iliskin esaslari düzenlemek temaslari yürütmek ve bayi stok ve alacak riskini yönetmek, 4.	Mevcut müsteri ve bayi iliskilerinin sürekliligini saglamak gelistirmek  pazar ve müsteriler hakkindaki bilgilerin güncel tutulmasi faliyetlerini yönetmek, 5.	Turquality Programi  kapsaminda ticari araçlar ihracat Pazarlama Planini olusturmak ve uygulamak, 6.	Bagli çalisanlarinin kisisel ve mesleki gelisimi ile yetkinliklerinin artirilmasina yönelik çalismalarin programlamak ve izlemek, 7.	Dis ticaret  islemleriyle ilgili mevzuati takip etmek ihracatla ilgili kamu kuruluslariyla temaslari yürütmek ve üst yönetimin ihracatla ilgili ihtiyaç duyacagi verilerin düzenlenmesini saglamak,  1. Ticari araçlar dis satis ve pazarlama temel politika strateji ve hedeflerini belirlemek pazarlama ve satis ile ilgili kisa ve uzun vadeli planlari hazirlamak ve uygulanmasini saglamak, 2. Dis pazarlardaki müsteri ihtiyaçlarini algilamak çözüm üretmek müsteriye özel esnek satis yöntemleri gelistirmek uzun vadeli ve sürdürülebilir iliskiye yönelik fiyat politikalari olusturmak ve uygulamak, 3. Yurt disi pazarda satis kanallarini belirleyici çalismalar yapmak  olusturulacak acentalik ve bayiliklere iliskin esaslari düzenlemek temaslari yürütmek ve bayi stok ve alacak riskini yönetmek, 4. Mevcut müsteri ve bayi iliskilerinin sürekliligini saglamak gelistirmek  pazar ve müsteriler hakkindaki bilgilerin güncel tutulmasi faliyetlerini yönetmek, 5.Yurt disi pazarlardaki uluslararasi ihalelere katilim ve teklif sürecini yönetmek, 6. Turquality Programi  kapsaminda ticari araçlar ihracat Pazarlama Planini olusturmak ve uygulamak, 7. Bagli çalisanlarinin kisisel ve mesleki gelisimi ile yetkinliklerinin artirilmasina yönelik çalismalarin programlamak ve izlemek, 8. Dis ticaret  islemleriyle ilgili mevzuati takip etmek ihracatla ilgili kamu kuruluslariyla temaslari yürütmek ve üst yönetimin ihracatla ilgili ihtiyaç duyacagi verilerin düzenlenmesini saglamak, 9. Sektör ürün ve hizmetler  satis ve pazarlama alanindaki yeni trendleri takip etmek ve firma stratejilerine entegre etmek,  Sirketin orta ve uzun vadeli büyüme hedefleri
dogrultusunda is gelistirme ve ürün stratejilerini belirlemek organizasyon
genelinde stratejik önceliklerin netlesmesini ve sahiplenilmesini saglamak., Küresel ticari araç ekosistemindeki dönüsümü
(elektrifikasyon sürdürülebilirlik dijitallesme) öngörerek yenilikçi ve
rekabetçi ürün yol haritalarini olusturmak gelecegin mobilite çözümlerini
sekillendirmek., Ürün portföyünü stratejik öncelikler ve sermaye
verimliligi perspektifiyle yönetmek kaynak tahsisini sirket degerini maksimize
edecek sekilde yönlendirmek., Uluslararasi pazarlardaki büyüme firsatlarini
sistematik olarak analiz etmek farkli cografyalarin regülasyon müsteri ve
rekabet dinamiklerine uygun stratejik aksiyonlar gelistirmek., Ar-Ge üretim finans satis ve tedarik zinciri
fonksiyonlarini ortak hedeflerde hizalamak veri temelli ve hizli karar alma
kültürünü güçlendirmek, Sirket içinde yenilikçi düsünceyi tesvik eden dis
paydaslarla (tedarikçiler teknoloji firmalari üniversiteler) is birliklerini
güçlendiren sürdürülebilir bir inovasyon kültürü olusturmak., Yüksek performansli hesap verebilir ve is birligi
odakli ekipler insa etmek yetenek gelisimi mentorluk ve lider yetistirme
yaklasimiyla organizasyonel sürdürülebilirligi saglamak. Güven temelli açik
iletisimi destekleyen ve sürekli ögrenmeyi tesvik eden bir kültürün liderligini
yapmak., Organizasyonel dönüsüm
 projelerinde yön gösterici rol üstlenmek belirsizlik ortaminda netlik
     saglayan çevik ve çözüm odakli bir liderlik yaklasimi sergilemek. , KPI bazli performans takip sistemlerini kurmak ve
iyilestirmek stratejik hedeflerin ölçülebilir çiktilarla desteklenmesini
saglamak., Çevik çalisma metodolojisinin gerekliliklerinin (daily, sprint planlama, review vb.) yerine getirilmesini saglamak., ";HAKAN BUBIK
003731;AA PAZ MÜST HIZM VE PROJ GR DIREKTÖRLÜGÜ;AA PAZ MÜST HIZM VE PROJ GR DIREKTÖRLÜGÜ;Sirket hedefleri dogrultusunda belirlenen Zirhli Projelerinin yönetimini saglanmasi;"TEP04201 Tasarim prosedürü
TET04201 Ürün siniflandirma talimati
TET04202 Prototip hazirlama ve yönetimi talimati
TET04203 Tasarim planlama talimati
TET10201 Prototip test talimati
ISO Standartlari
TSE Standartlari ve
DIN Standartlari çerçevesinde çalisir.
";" 1. Tekerlekli Zirhli Araçlar Projeler Müdürlügü bünyesinde yürütülen projelerin takibini yapmak. Projelerin ön hazirlik sürecini tamamlamak zaman planlarini olusturmak proje uygulama sürecini ve aktivitelerini koordine ve yönetmesine yardimci olmak., 2.  Arastirma ve gelistirme projeleri kapsaminda tasarlanacak ürünlerin mukayeseli rakip analizlerini yapmak. Ürünün pazardaki rakiplerini tanimak ürünlerin birbirleriyle olan kiyaslamasini yapmak  ürünün pazarda basarili olabilmesi için diger rakip, 3. Tasarlanan  araçlarin türevlerini ve spesifikasyonlarini (teknik özellikler iç ve dis donanim) belirlenmesine yardimci olmak ve takibini yapmak., 4. Araç projelerinde Tekerlekli Zirhli Araçlar Projeler Müdürlügü ile diger fonksiyonel birimler  arasindaki isbirligi ve koordinasyonu saglamak. Bu birimlerden proje bazinda gelen talepleri (toplanti bilgi temini) degerlendirmek ve taleplere karsili, 5.  Arastirma ve Gelistirme projelerine destek/tesvik için gerekli basvurulari yapmak. Onaylanan projelerin faaliyetlerini yürütmek., 6.  Tekerlekli Zirhli Araçlar ile ilgili yürütülen ihale çalismalarinda gerekli dokümantasyonu (teknik spec karsilastirma tablosu araç bilgileri sirket bilgileri...vb) hazirlamak satis/pazarlama departmanlarina müsteri ihtiyaçlari ile ilgili destek o, 7. Tekerlekli Zirhli Araçlar kapsaminda yürütülen proje çalismalarinda görev donanimlarini arastirmak specleri belirlemek tedarikçi ile görüsmek fiyat teklifi almak tasarim ve satinalma birimleri ile koordinasyonu saglanmak, Çevik çalisma metodolojisinin gerekliliklerinin (daily, sprint planlama, review vb.) yerine getirilmesini saglamak., ";MÜMIN SÖNMEZ
