SicilNo;Birim;Mudurluk;Amac;Yetki;AnaSorumluluk;ad_soyad
000397;AA PAZ MÜST HIZM VE PROJ GR DIREKTÖRLÜGÜ;AA PAZ MÜST HIZM VE PROJ GR DIREKTÖRLÜGÜ;"Satis Sonrasi Hizmetlerin  hizli ve uygun maliyetler ile verilerek Araçlarin göreve hazir olma oraninin yüksek tutulmasi  sonucu müsteri memnuniyeti saglanmak Hizmet Sözlesmeleri ve Yedek Parça ciro katkisi ile sürdürülebilir yapi olusturmaktir. ";"Servis organizasyonu prosedürü Servis çalisma düzeni prosedürü Servis bülteni prosedürü Servis denetleme ve
degerlendirme prosedürü Müsteri sikayetleri degerlendirme prosedürü Garanti islemleri prosedürü Tüketici Koruma 
Kanunu  (OSD) Otomotiv Sanayii Dernegi kararlari Garanti Sistemi Kurallari Kalibrasyon prosedürü ve birim
yöneticisinin yönlendirmesi çerçevesinde çalisir.
";" •	Askeri Araçlar Satis Sonrasi Hizmetler Faaliyetlerinin organizasyonunu yapmak., 1.	Askeri Araçlar Yetkili Servisler ilgili denetim iyilestirme iliskileri gelistirme çalismalarini yürütmek., •	servis ziyaretlerinde bulunmak, •	servislerin teknik kapasitelerinin yeterli düzeye getirilmesini saglamak., 2.	Tüm Filo müsterilerle iliskileri düzenlemek., •	Saha faaliyetleri ile araçlarin iyilestirilmesi için gerekli kampanya faaliyetlerinin organizyonu., •	En çok karsilasilan sikayet ve sorunlarin tespitini yapmak ve degerlendirmek, 3.	Üretilen özel donanimli araçlarda karsilasilan sorunlarin çözümüne teknik destek vermek fiili bakim/onarim yapilmasini saglamak ve bu araçlarin takibatini yapmak., 4.	Filo müsteri egitimleri organizasyonu yapmak, 5.	Filo araçlari teslimatinda teknik destek verilmesini saglamak, 6.	Hazirlanan Teknik Bültenlerin Kontrolünü yapmak, 7.	Kamu Kuruluslari ile resmi yazismalarin yapilmasi., 8.	Garanti giderlerinin düsmesini teknik proplemlerin raporlanmasi ve iyilestirme çalistirmalari takibi yönü ile saglamak.,  . Askeri Araçlar Satis Sonrasi Hizmetler Faaliyetlerinin tüm organizasyonundan sorumludur., . Askeri Araçlar Yetkili Servisler (Network) ve Yedek Parça Bayi  yapilandirma denetim iyilestirme gelistirme çalismalarini yürütmek.., . Tüm Kullanicilar KKKJandarmaEGM HKK vb ile  Yurt disi Kullanicilari ile Satis Sonrasi iliskileri düzenlemek, . Yedek Parça Pazarlama Satis  ile Ciro katkisi saglamak, . Kullanici ve paydaslara Egitimler organizasyonu, . Araç Teslimatlari ( PDI ) islemlerinin gerçeklestirilmesi, . Kamu Kuruluslarindan  Otokar’a bildirilen teknik/idari konularin yönetilmesi / Hukuki Süreçler Yönetimi, . Kamu Ihale Yasasina uygun olarak Hizmet Sözlesmeleri Yapmak ve Yürütmek., . Garanti giderlerinin düsmesini saglamak teknik problemlerin raporlanmasi ve Araç iyilestirme çalismalari, Çevik çalisma metodolojisinin gerekliliklerinin (daily, sprint planlama, review vb.) yerine getirilmesini saglamak., ";SERDAR SAKAR
000808;AA PAZ MÜST HIZM VE PROJ GR DIREKTÖRLÜGÜ;AA PAZ MÜST HIZM VE PROJ GR DIREKTÖRLÜGÜ;Projenin teknik açidan sartname gereksinimleri ve müsteri beklentilerini karsilayacak sekilde gerçeklestirilmesi;Yukarida belirtilen ana sorumluluklari gerektiginde Sistem Mühendisligi Tasarim Üretim Kalite ve Satis Sonrasi ekipleriyle de organize olarak gerçeklestirmeye yetkilidir.;" 1. Altay projesi kapsaminda parça  resim sartname ve speklerin incelenmesi ürün dogrulama testlerinin tespiti parça bazinda kritik özellikler tespit ederek/ettirerek girdi kontrol planlarinin olusturulmasi tedarikçide proses kontrol planlarinin olust, 2. Altay Projesi kapsaminda ürün ve hizmet saglayacak tedarikçi adayi firmalarin seçme ve degerlendirme denetimlerinin gerçeklestirilmesi, Çalisilmasi düsünülen firmalarda iyilestirme faaliyetlerinin takip edilmesi., 3. Altay Projesi kapsaminda girdi kalite kontrol faaliyetlerinin gerçeklestirilmesi (ilk numune ve seri parçalar), 4. Uygunsuz girdi malzemelerle ilgili uygun olmayan ürün yönetimini saglamak, 5. Altay Projesi kapsaminda dis kaynakli laboratuvar ve test/muayene imkanlarini arastirarak Otokar için kullanilmasi saglamak., 6. Altay Projesi kapsaminda montaj hattinda girdi malzemelerle ilgili olarak tedarikçi kaynakli problem çiktigi takdirde düzeltici faaliyetleri gerçeklestirmek problem çözme faaaliyetlerini koordine etmek., Proje ekibi ile birlikte çalisarak Proje Yönetim Planina girdiler yapmak prototip ara kontrol noktalarini belirlemek nihai prototip kabul sürecini yürütmek., Ürün ömürüne yönelik kalite beklentilerini ortaya koymak ve gereksinimleri çikarmak (örnek MTBF hedefi paslanmazlik boya sizdirmazlik vs), Sistem Alt Sistem Proje ve OTOKAR Kalite ekipleri ile birlikte çalisarak ana proje takvimine uygun olarak alt sistem kalite adimlarini belirlemek askt planini olusturmak risk yönetimine girdi vermek alt sistem kalifikasyon dosyasini olusturmak, ASKT test sartlari ve test siralamasiyla ilgili girdiler yapmak, Prototip üretimde hangi asamalarda ne tür ara kontroller yapilacagina karar vermek planlamak ve bu plana uygun olarak kontrollerin gerçeklestirilmesini saglamak, Tasarim ekipleri ve sistem mühendisligi ile birlikte araç kritik parçalarini belirlemek, Tasarim ekipleri ve sistem mühendisligi ile birlikte araç izlenebilirlik sistemine dahil olacak parçalari belirlemek, Teknik resimlere aktarilmasi gereken kritik özelliklerle alakali tasarim ekiplerine girdiler vermek, Prototip üretim ve SKT/ASKT süreçlerindeki uygunsuzluklari takip etmek  tüm uygunsuzluklarin proje takvimine uygun olarak kapatilmasini yöneterek ürün kalitesini güvence altina almak., Tasarim kalifikasyon üretim kalite vb  süreçleri ilgili projenin teknik isterlerine göre kontrol etmek, Askeri araç projelerinin risk analizlerini yapmak ve riskleri takip etmek, Araç kabullerinde sorun çikmamasi için sözlesme imzalanmasindan itibaren teknik ister bazinda kontroller yapmak ilgili ekiplerin koordinasyonunu saglamak kabullere katilmak, Araçlarin üretim sürecinde ya da satis sonrasi sürecinde müsterinin ilave taleplerini/sikayetleri teknik olarak anlayip yapilabilirligini degerlendirmek teknik idari ve mali açidan uygunlugunu degerlendirmek ve ilgili iç süreçleri takip etmek., Askeri araç ihalelerinde müsterinin ve kullanicinin teknik ister ve beklentilerini anlamak  ilgili birimlere aktarmak  teknik cevaplarin en uygun sekilde hazirlanmasini saglamak, Otokar’in yetenekleri ve kabiliyetleri konusunda müsteriye sunulacak dokümanlari hazirlamak ve sunmak, Müsterinin halihazirda kullanmakta oldugu araçlar veya rakip araçlari incelemek benchmark analizleri yapmak ve raporlamak, Müsteriye gidecek teknik dökümantasyonun teknik yeterligini ve uygunlugunu sorgulamak, Tasarim kalifikasyon üretim kalite vb  süreçleri ilgili projenin teknik isterlerine göre kontrol etmek, Askeri araç projelerinin risk analizlerini yapmak ve riskleri takip etmek, Araç kabullerinde sorun çikmamasi için sözlesme imzalanmasindan itibaren teknik ister bazinda kontroller yapmak ilgili ekiplerin koordinasyonunu saglamak kabullere katilmak, Araçlarin üretim sürecinde ya da satis sonrasi sürecinde müsterinin ilave taleplerini/sikayetleri teknik olarak anlayip yapilabilirligini degerlendirmek teknik idari ve mali açidan uygunlugunu degerlendirmek ve ilgili iç süreçleri takip etmek., Askeri araç ihalelerinde müsterinin ve kullanicinin teknik ister ve beklentilerini anlamak  ilgili birimlere aktarmak  teknik cevaplarin en uygun sekilde hazirlanmasini saglamak, Otokar’in yetenekleri ve kabiliyetleri konusunda müsteriye sunulacak dokümanlari hazirlamak ve sunmak, Müsterinin halihazirda kullanmakta oldugu araçlar veya rakip araçlari incelemek benchmark analizleri yapmak ve raporlamak, Müsteriye gidecek teknik dökümantasyonun teknik yeterligini ve uygunlugunu sorgulamak, Çevik çalisma metodolojisinin gerekliliklerinin (daily, sprint planlama, review vb.) yerine getirilmesini saglamak., ";BAHADIR AKGÜL
000806;TESIS LOJISTIK TAKIMI;PLANLAMA, TESIS LOJ & IHRACAT OPER LID;Yedek parça deposuna gelen parçalarin giris ve çikis asamalarinda gerekli islemlerin yapilmasi ve malzemelerin yerlestirilmesi;"Üretim devamliligi konularinda karar verme ve ekibini yönetme.
Lojistik Projelerinde aktif rol almak.
Maliyet iyilestirme projelerinde sorumlu oldugu stoklarin analizi yapmak ve aksiyonlarini aldirmak.
";" 1. Internet ortaminda gelen siparislerin sevkiyatlarinin organize edilmesi., 2. Depo giris ve çikislarinin yapilmasi.Ilgili evraklarin dosyalanmasi., 3. Fabrika üretim ambarindan yedek parçaya yapilan çikislarin sisteme aktarilmasi., 4. Acil Sevkiyatlarin takibi stogumuzda olmayan parçalarin fabrika ambarindan veya banttan tespit ve temini. Bu islemlerle ilgili tüm kayitlarin yapilmasi ve özel acil siparisin verilerek parçanin sevkinin saglanmasi., 5. Yil sonu ve ara depo sayimlari ile ilgili stok adetleri tesbiti sayim adetlerinin bilgisayara girilmesi., 6. Yurtdisindan gelen parçalarindan eksik veya fazla çikanlarla ilgili fark tutanaginin tanzimi., 7. Stok eksik parçalarinin tespit edilerek konunun çözüzmlenmesi, 8. Depo içindeki raf adreslerinin degisikliklerinin sisteme girilmesi., 9. Müsteri iadelerin stoklara alinmasi ve firma iadelerinin takip edilmesi, 10. Acil olup gelis tarihinde aksama olan parçalarin Malzeme Biriminden takibi., 11. Yurtiçi ihalelerle ilgili sevkiyat takiplerinin yapilmasi., 12. Depo tertip ve düzenin saglanmasi, 13. Depoalar arasi parçalarin hareketinin saglanmasi, 14. Hurda parçalarin hurdaya  atilmasi, 15. Mavi yaka perfomans degerlendirmelerinin yapilmasi, 16. Stok ve depo ile ilgili aylik raporlarin alinmasi., 17. Parçalarin paketleme tiplerine ve adetlerine karar verilmesi, 18. Depoda 5S uygulamalarinin yapilmasi., 19. Acil olup gelis tarihinde aksama olan parçalarin Malzeme Biriminden takibi.,  5. Yil sonu ve ara depo sayimlari ile ilgili stok adetleri tesbiti sayim adetlerinin bilgisayara girilmesi., 7. Stok eksik parçalarinin tespit edilerek konunun çözüzmlenmesi, 10. Acil olup gelis tarihinde aksama olan parçalarin Malzeme Biriminden takibi., 12. Depo tertip ve düzenin saglanmasi, 13. Depoalar arasi parçalarin hareketinin saglanmasi, 14. Hurda parçalarin hurdaya  atilmasi, 15. Mavi yaka perfomans degerlendirmelerinin yapilmasi, 16. Stok ve depo ile ilgili aylik raporlarin alinmasi., 18. Depoda 5S uygulamalarinin yapilmasi., • Tesis Lojistik sorumlulugundaki faaliyetler ile ilgili darbogazlarin tespiti ve gerekli analizlerin yapilmasi ile çözüm önerilerinin getirilmesi., • Bagli bulundugu amirleri ile koordineli çalisarak ayni hedefe yönelik çalismalarin yapilmasi., • Sorumlu oldugu alanlardaki is planlarinin yapilmasi. çalisanlarin yilliz izin planlamalari ekipman ihtiyaçlari gibi durumlarin tespit ve organizasyonu., • Bagli bulundugu bölümün KPI takip ve raporlamalarini yapmak., • 5S/Yalin Üretim gibi iyilestirme faliyetlerine katilmak., • Bagli ekiplerin Kaizen/öneri verme oraninin arttirilmasi., • Ekipman takip sisteminin gelistirilmesi ve ihtiyaçlarin anlik görülmesinin saglanmasi. çözüm konusunda ilgili departmanlar ile saglikli iletisim kurulmasi., Çevik çalisma metodolojisinin gerekliliklerinin (daily, sprint planlama, review vb.) yerine getirilmesini saglamak., ";ADIL TANK
001007;TESIS LOJISTIK TAKIMI;PLANLAMA, TESIS LOJ & IHRACAT OPER LID;"Yedek parça Arge  birimlerinden talep edilen malzemelerin ambar ve üretim .lokasyonlarindan hazirlatilmasi ve teslimi.
Sap stok kontrol takibi islemlerine destek verilmesi.
Antrepolarin Gümrük Prosedürlerine uygun sekilde çalismasinin saglanmasi.
Iveco ithal tesellümünün yapilmasi";"Lojistik ve Planlama Direktörü yönlendirmesi ve onayi dogrultusunda çalisir

";" . Ambardan ve y.ok alanindan bantlara verilen malzemelerin sistem üzerinden transferlerini yapmak, . Yedek parça biriminin fabrikaya açtigi acil ve bakiye siparisleri takip etmekraporlamak  ve Yedek Parça birimine verilen yedek parçalarin  sistem hareketlerini yapmak, . Land Rover set sandiklarini sistem üzerinde açmak., . Arge atölyesinin fabrikaya açtigi siparisleri takip etmek ve verilen parçalarin sistem hareketlerini yapmak., . Siparis fazlasi gelen malzemelerin iade irsaliye ve faturalarini kesmek.Ay sonu raporlamalarini yapmak., . Garanti otomasyon sistemi dahilinde firmalara gönderilecek malzemelere ait irsaliye ve fatiura kesiml islerini yapmak., . Sorumluluk alanindaki çalismalarin Çevre Enerji Is Sagligi ve Güvenligi ile ilgili talimat ve kurallara uygun yapilmasini ilgili birimler ile koordineli olarak gerekli önleyici tedbirlerin alinmasini ve gelisimini saglamak, YYS kapsaminda MHB Süreçlerinde ISO 27001 Kontrolerini saglamak güncelleme yapmak, Malzeme Hareketleri Birimine ait Degerli evrak Arsivini takip etmek, YYS kapsaminda Planlama Birimi Talimat ve prosedürlerin takip etmek güncellemek, YYS Kapsaminda Güncellenen Talimat ve Prosedürler, onularinda Çalisanlara Egitim vermek, YYS kapsaminda yapilacak egitim ve toplantilara katilmak, .,  . Ambardan ve y.ok alanindan bantlara verilen malzemelerin sistem üzerinden transferlerini yapmak, . Yedek parça biriminin fabrikaya açtigi acil ve bakiye siparisleri takip etmekraporlamak  ve Yedek Parça birimine verilen yedek parçalarin  sistem hareketlerini yapmak, . Land Rover set sandiklarini sistem üzerinde açmak., . Arge atölyesinin fabrikaya açtigi siparisleri takip etmek ve verilen parçalarin sistem hareketlerini yapmak., . Siparis fazlasi gelen malzemelerin iade irsaliye ve faturalarini kesmek.Ay sonu raporlamalarini yapmak., . Sorumluluk alanindaki çalismalarin Çevre Enerji Is Sagligi ve Güvenligi ile ilgili talimat ve kurallara uygun yapilmasini ilgili birimler ile koordineli olarak gerekli önleyici tedbirlerin alinmasini ve gelisimini saglamak, YYS kapsaminda MHB Süreçlerinde ISO 27001 Kontrolerini saglamak güncelleme yapmak, Malzeme Hareketleri Birimine ait Degerli evrak Arsivini takip etmek, YYS kapsaminda Planlama Birimi Talimat ve prosedürlerin takip etmek güncellemek, YYS kapsaminda yapilacak egitim ve toplantilara katilmak, Malzeme haraketleri biriminin sarf malzeme ihtiyaçlarinin takibi ve taleplerin açilmasi, SAP ara depolarin periyodik kontrolü ve raporlanmasi, Üretim hatlarina günlük otomatik bant yükleme taleplerinin olusturulmasi, Malzeme hareketleri birimi süreç raporlarinin hazirlanmasi ve takibi, Yedek parça biriminin 1000 üretim yerinden  talep ettigi siparislerin  ambar ve üretim stoklarindan fiili ve kaydi olarak takip edilmesi, Tank  biriminin 1000 üretim yerinden  talep ettigi siparislerin  ambar ve üretim stoklarindan fiili ve kaydi olarak takip edilmesi, Kit olarak gelen malzemelerin (land rover am general) sistemsel takiplerinin yapilmasi, Malzeme Hareketleri Birimine ait Degerli evrak Arsivini takip etmek, ARGE ve mühendislik birimleri tarafindan 1000 üretim yerinden talep edilen malzemelerin fiili ve kaydi olarak aktarimlarinin takip edilmesi, Yedek parçadan üretimde kullanilmak üzere talep edilen malzemelerin fiili ve kaydi olarak aktarimlarinin takip edilmesi, Set harici olarak konsinye firmalarindan talep edilen malzemelere ait evraklarin sistemsel olarak girislerinin takip edilmesi, Prototip kodlu gelen arge rezervasyonu olmayan malzemelerin takip edilmesi, YPTR VE ARGD olarak giris yapilan malzemelerin sistemsel düsüm programinin düsümünün kontrolünün yapilmasi, Üretime girecek olan araçlara ait otomatik bant yükleme sistemenin çalistirilmasi, SRM sistem ile talep edilecek olan malzemelerin takip edilmesi kirtasiye ürünlerinin depolanmasi, YP - ARGE - Tank tarafindan talep edilen bölhoff konsinye malzemelerine rez. açilmasi, Telsiz - elterminali -zimmetle teslim edilen tüm ekipmanlarin takip edilmesi, Yedek parçanin bildirecegi sevk depo yerinden iç imalat malzemelerin kayitlarinin aktarilmasi, Otomatik bant yükleme harici tutulan malzeme listesinin takip edilmesi, Hatali giris yapilan malzemelerin ters kayitlarinin alinmasi, YPTR - ARGD - Tamg - sevk depolarinda bulunan kayitlarin takip edilmesi, Üretim harici kullanilan muhasebe onayi ile kayit tüketimleri (971 - 973- 241), Yedek parça biriminin 1000 üretim yerinden  talep ettigi siparislerin  ambar ve üretim stoklarindan fiili ve kaydi olarak takip edilmesi, Tank  biriminin 1000 üretim yerinden  talep ettigi siparislerin  ambar ve üretim stoklarindan fiili ve kaydi olarak takip edilmesi, Kit olarak gelen malzemelerin (land rover am general) sistemsel takiplerinin yapilmasi, Malzeme Hareketleri Birimine ait Degerli evrak Arsivini takip etmek, ARGE ve mühendislik birimleri tarafindan 1000 üretim yerinden talep edilen malzemelerin fiili ve kaydi olarak aktarimlarinin takip edilmesi, Yedek parçadan üretimde kullanilmak üzere talep edilen malzemelerin fiili ve kaydi olarak aktarimlarinin takip edilmesi, Set harici olarak konsinye firmalarindan talep edilen malzemelere ait evraklarin sistemsel olarak girislerinin takip edilmesi, Prototip kodlu gelen arge rezervasyonu olmayan malzemelerin takip edilmesi, YPTR VE ARGD olarak giris yapilan malzemelerin sistemsel düsüm programinin düsümünün kontrolünün yapilmasi, Üretime girecek olan araçlara ait otomatik bant yükleme sistemenin çalistirilmasi, SRM sistem ile talep edilecek olan malzemelerin takip edilmesi kirtasiye ürünlerinin depolanmasi, YP - ARGE - Tank tarafindan talep edilen bölhoff konsinye malzemelerine rez. açilmasi, Telsiz - elterminali -zimmetle teslim edilen tüm ekipmanlarin takip edilmesi, Yedek parçanin bildirecegi sevk depo yerinden iç imalat malzemelerin kayitlarinin aktarilmasi, Otomatik bant yükleme harici tutulan malzeme listesinin takip edilmesi, Hatali giris yapilan malzemelerin ters kayitlarinin alinmasi, YPTR - ARGD - Tamg - sevk depolarinda bulunan kayitlarin takip edilmesi, Üretim harici kullanilan muhasebe onayi ile kayit tüketimleri (971 - 973- 241), Otokarin Gümrük Müdürlügüne karsi Antrepo Yetkilisi olarak temsil edilmesi, Yeklilendirilmis Gümrük Müsaviri ile düzenlenecek tutanak ve tespit sözlesmelerinin imzalanmasi tespit sözlesmelerinin yenilenmesi Fesh edilmesi, Antrepo stok kayitlarinin tutulmasi, Tespit islemleri ve Gümrük Denetlemelerinde Antrepo yetkilisi olarak Otokar Otomotiv ve Savunma San. A.S firmasini temsil etmek, Fabrikaya giren Tüm Ithal malzemelerin sorunsuz ve eksiksiz olarak teslim alinmasi Ambar bölgelerine malzemelerin teslim edilmesinin saglanmasi, Yedek parça biriminin 1000 üretim yerinden  talep ettigi siparislerin  ambar ve üretim stoklarindan fiili ve kaydi olarak takip edilmesi, ARGE ve mühendislik birimleri tarafindan 1000 üretim yerinden talep edilen malzemelerin fiili ve kaydi olarak aktarimlarinin takip edilmesi, Yedek parçadan üretimde kullanilmak üzere talep edilen malzemelerin fiili ve kaydi olarak aktarimlarinin takip edilmesi, Set harici olarak konsinye firmalarindan talep edilen malzemelere ait evraklarin sistemsel olarak girislerinin takip edilmesi, Prototip kodlu gelen arge rezervasyonu olmayan malzemelerin takip edilmesi, YPTR VE ARGD olarak giris yapilan malzemelerin sistemsel düsüm programinin düsümünün kontrolünün yapilmasi, Üretime girecek olan araçlara ait otomatik bant yükleme sistemenin çalistirilmasi, SRM sistem ile talep edilecek olan malzemelerin takip edilmesi kirtasiye ürünlerinin depol";SELÇUK YAMAN
