SicilNo;Birim;Mudurluk;Amac;Yetki;AnaSorumluluk;ad_soyad
010206;TA SSH & YEDEK PARÇA SAT LID - AVRUPA;TA SSH & YEDEK PARÇA SAT LID - AVRUPA;"SSH departmanindan müsterinin Otokar içerisindeki point of contact i olmak. Müsteriden gelen sikayetin analizini yapip çözümü için gerekli ekipler ile kordine bir sekilde müsteriye en hizli sekilde destek olmak ve beklentilerini en hizli sekilde karsilamak. ";Yöneticisinin yönlendirmesiyle çalisir;" KVK Is Birim Sorumlusu sifatiyla bagli bulundugu departmana ait KVK envanteri ve süreçlerini yönetmek Sirketin KVK politika ve prosedürlerini uygulamak KVK Proje Ekibi ile koordineli olarak gerekli risk önleyici tedbirlerin alinmasini ve gelisimini saglamak., Yeni devreye aldigimiz ürünlerde kalite odakli yaklasimla parçalarin tedarik edilmesi., Sorumlu olunan firmalarin hammadde isçilik ve genel gider artislarini cost table ve analizle kontrol edip firmalarin fiyatlarini kontrol altinda tutulmasini saglamak., Hali hazir da mevcut tedarikçiler ile iliskileri gelistirmek ve bunun yaninda rekabet yaratacak tedarikçileri bulmak.,  KVK Is Birim Sorumlusu sifatiyla bagli bulundugu departmana ait KVK envanteri ve süreçlerini yönetmek Sirketin KVK politika ve prosedürlerini uygulamak KVK Proje Ekibi ile koordineli olarak gerekli risk önleyici tedbirlerin alinmasini ve gelisimini saglamak., Müsteriye zamaninda dogru ve eksiksiz bilgi saglamak., Müsterinin karsilastigi sorunlari dogru analiz edip ilgili ekipler ile kordineli sekilde müsteriye destek olmak, Sorumlu olunan Ülkelerdeki araçlar hakkinda genel bilgi hakimiyetinin olusmasi ( garanti süresi kaç araç var vb.), Çevik çalisma metodolojisinin gerekliliklerinin (daily, sprint planlama, review vb.) yerine getirilmesini saglamak., ";MUSTAFA OGUZHAN ÇINAR
010300;GLOBAL SATIS SONRASI TEDARIK ZINCIRI LID;GLOBAL SATIS SONRASI TEDARIK ZINCIRI LID;Optimum karsilama orani ve stok seviyesini hedefleyerek minimum maliyet ile maksimum müsteri memnuniyeti saglamak;Yönetici onayi ve yönlendirmesi dahilinde çalisir;" Uçtan uca yedek parça planlama süreçlerinin yönetimi ve yedek parça islemleri için ana veri yönetimi, Yedek parça stok seviyelerinin optimum sekilde belirlenmesi ve manuel tahmin analizi ile ince ayar yapilmasi., Sistematik ve/veya manuel olarak kritik stok baslangiç stok ve mevsimsel talep tahmini ve planlamasinin yapilmasi, Geçmis tüketim ve satis verilerinin tahminlerin emniyet stokunun ve teslimat sürelerinin analizine dayali satin alma siparislerinin olusturulmasiyla birlikte yedek parça siparis yönetimi, Talep ve pazar egilimlerindeki degisikliklere dayali olarak tahminleme siparis planlama ve stok seviyesinin ayarlanmasi. Tedarik ekibi ile yerel ve küresel tedarikçilerle ilgili eksiklikler konusunda iletisim kurmak ve erken teslimat için aksiyon alip takibini yapmak, Satis verileri ve ilgili departmanlardan gelen talepler dogrultusunda malzeme ihtiyaç planlamasini yapmak ve gerekli satin alma taleplerini olusturmak, Aciliyetine göre siparisleri önceliklendirip organize etmek, Sistemdeki tüm yedek parçalar için stratejiler ve iyilestirmeler gelistirmek. Optimum stogu korumak ve asiri stoklama ve kisa kalmayi önlemek için stok seviyelerini düzenleyerek gerekli önlemleri almak, Satis Üretim ve Malzeme Planlama Satis Sonrasi ve Lojistik ekipleriyle birlikte çalisarak talep tahminleri için güncel ve dogru bilgileri elde etmek ve saglamak için isbirlikçi ve uzlasmaci bir yaklasim kullanmak, Stok seviyesi karsilama orani ve müsteri teslimat süreleri gibi kriterlerle ilgili gerekli raporlarin hazirlanmasi, Yeni araçlar için ilgili departmanlar ile koordineli olarak özel projelerin yürütülmesi, Katalog ekibi ile referans numaralarinin saglanmasi ve baslangiç stogun tutulmasinin saglanmasi, Terminli ve özel fiyatli siparislerin sistemde uygun sekilde açilip tedarikçi ile gerekli koordinasyonunun saglanmasi, Satinalma ile koordineli bir sekilde minimum siparis adetlerinin ve termin sürelerinin iyilestirme çalismalarinin yapilmasi, Otokarin sahip oldugu diger depolari ve diger lokasyonlari için stok ve siparis yönetimi ile ilgili koordinasyonun saglanmasi, Otokar yedek parça servis ve bayilerinde ellerinde bulundurmasi gereken parçalarin stok seviyelerinin ilgili bölgelerdeki araç parkina istinaden ayarlanmasi DMS sistemi için her bayi ve servis özelinde database in olusturulmasi güncel tutulmasi., Yedek parça stok ve siparis yönetiminde dijital dönüsüm ve süreç iyilestirme projelerinin koordinasyonu, Uçtan uca yedek parça planlama süreçlerinin yönetimi ve yedek parça islemleri için ana veri yönetimi, Yedek parça stok seviyelerinin optimum sekilde belirlenmesinbspiçinnbspdijital dönüsüm kapsaminda talepnbsptahmini ve envanter optimizasyonu programinin yönetimi,  Sistematik ve/veya manuel olarak kritik stok baslangiç stok ve mevsimsel talep tahmini ve planlamasinin yapilmasi, Geçmis tüketim ve satis verilerinin tahminlerin emniyet stokunun ve teslimat sürelerinin analizine dayali satin alma siparislerinin olusturulmasiyla birlikte yedek parça siparis yönetimi, Talep ve pazar egilimlerindeki degisikliklere dayali olarak tahminleme siparis planlama ve stok seviyesinin ayarlanmasi. Tedarik ekibi ile yerel ve küresel tedarikçilerle ilgili eksiklikler konusunda iletisim kurmak ve erken teslimat için aksiyon alip takibini yapmak, Satis verileri ve ilgili departmanlardan gelen talepler dogrultusunda malzeme ihtiyaç planlamasini yapmak ve gerekli satin alma taleplerini olusturmak, Aciliyetine göre siparisleri önceliklendirip organize etmek, Sistemdeki tüm yedek parçalar için stratejiler ve iyilestirmeler gelistirmek. Optimum stogu korumak ve asiri stoklama ve kisa kalmayi önlemek için stok seviyelerini düzenleyerek gerekli önlemleri almak, Satis Üretim ve Malzeme Planlama Satis Sonrasi ve Lojistik ekipleriyle birlikte çalisarak talep tahminleri için güncel ve dogru bilgileri elde etmek ve saglamak için isbirlikçi ve uzlasmaci bir yaklasim kullanmak, Stok seviyesi karsilama orani ve müsteri teslimat süreleri gibi kriterlerle ilgili gerekli raporlarin hazirlanmasi, Yeni araçlar için ilgili departmanlar ile koordineli olarak özel projelerin yürütülmesi, Katalog ekibi ile referans numaralarinin saglanmasi ve baslangiç stogun tutulmasinin saglanmasi, Terminli ve özel fiyatli siparislerin sistemde uygun sekilde açilip tedarikçi ile gerekli koordinasyonunun saglanmasi, Satinalma ile koordineli bir sekilde minimum siparis adetlerinin ve termin sürelerinin iyilestirme çalismalarinin yapilmasi, Otokarin sahip oldugu diger depolari ve diger lokasyonlari için stok ve siparis yönetimi ile ilgili koordinasyonun saglanmasi, Otokar yedek parça servis ve bayilerinde ellerinde bulundurmasi gereken parçalarin stok seviyelerinin ilgili bölgelerdeki araç parkina istinaden ayarlanmasi DMS sistemi için her bayi ve servis özelinde database in olusturulmasi güncel tutulmasi., Yedek parça stok ve siparis yönetiminde dijital dönüsüm ve süreç iyilestirme projelerinin koordinasyonu, Çevik çalisma metodolojisinin gerekliliklerinin (daily, sprint planlama, review vb.) yerine getirilmesini saglamak., ";ÖZGÜN OSMANOGLU
010397;TESIS LOJISTIK TAKIMI;PLANLAMA, TESIS LOJ & IHRACAT OPER LID;"Tesis Lojistik operasyonlarinin etkin ve verimli bir sekilde saglanmasi için çalismalar yapmak.
Bu amaç dogrultusunda kendisine bagli personellerin sevk ve idaresini saglamak. ";Tesis Lojistik Birim Yöneticisinin yönlendirmesi ve onayi dogrultusunda çalisir;" Yedek parça biriminin 1000 üretim yerinden  talep ettigi siparislerin  ambar ve üretim stoklarindan fiili ve kaydi olarak takip edilmesi, ARGE ve mühendislik birimleri tarafindan 1000 üretim yerinden talep edilen malzemelerin fiili ve kaydi olarak aktarimlarinin takip edilmesi, Yedek parçadan üretimde kullanilmak üzere talep edilen malzemelerin fiili ve kaydi olarak aktarimlarinin takip edilmesi, Prototip kodlu gelen arge rezervasyonu olmayan malzemelerin takip edilmesi, YPTR VE ARGD olarak giris yapilan malzemelerin sistemsel düsüm programinin düsümünün kontrolünün yapilmasi, YP - ARGEnbsp tarafindan talep edilen bölhoff konsinye malzemelerine rez. açilmasi, Yedek parçanin bildirecegi sevk depo yerinden iç imalat malzemelerin kayitlarinin aktarilmasi, Hatali giris yapilan malzemelerin ters kayitlarinin alinmasi, YPTR - ARGD - Tamg - sevk depolarinda bulunan kayitlarin takip edilmesi, Üretim harici kullanilan muhasebe onayi ile kayit tüketimleri (971 - 973- 241), Otokarin Gümrük Müdürlügüne karsi Antrepo Yetkilisi olarak temsil edilmesi, Yeklilendirilmis Gümrük Müsaviri ile düzenlenecek tutanak ve tespit sözlesmelerinin imzalanmasi tespit sözlesmelerinin yenilenmesi Fesh edilmesi, Antrepo stok kayitlarinin tutulmasi, Tespit islemleri ve Gümrük Denetlemelerinde Antrepo yetkilisi olarak Otokar Otomotiv ve Savunma San. A.S firmasini temsil etmek, Fabrikaya giren Tüm Ithal malzemelerin sorunsuz ve eksiksiz olarak teslim alinmasi Ambar bölgelerine malzemelerin teslim edilmesinin saglanmasi, Yil sonu sayim programinin sistemsel hareketlerinin yapilmasi., beyaz yaka sayim listelerinin sistemsel olarak olusturulmasi, envanter etiket ve listelerin basimi., Envanter blokaj islemlerinin yapilmasi., Yedek parça biriminin 1000 üretim yerinden  talep ettigi siparislerin  ambar ve üretim stoklarindan fiili ve kaydi olarak takip edilmesi, ARGE ve mühendislik birimleri tarafindan 1000 üretim yerinden talep edilen malzemelerin fiili ve kaydi olarak aktarimlarinin takip edilmesi, Yedek parçadan üretimde kullanilmak üzere talep edilen malzemelerin fiili ve kaydi olarak aktarimlarinin takip edilmesi, Prototip kodlu gelen arge rezervasyonu olmayan malzemelerin takip edilmesi, YPTR VE ARGD olarak giris yapilan malzemelerin sistemsel düsüm programinin düsümünün kontrolünün yapilmasi, YP - ARGEnbsp tarafindan talep edilen bölhoff konsinye malzemelerine rez. açilmasi, Yedek parçanin bildirecegi sevk depo yerinden iç imalat malzemelerin kayitlarinin aktarilmasi, Hatali giris yapilan malzemelerin ters kayitlarinin alinmasi, YPTR - ARGD - Tamg - sevk depolarinda bulunan kayitlarin takip edilmesi, Üretim harici kullanilan muhasebe onayi ile kayit tüketimleri (971 - 973- 241), Otokarin Gümrük Müdürlügüne karsi Antrepo Yetkilisi olarak temsil edilmesi, Yeklilendirilmis Gümrük Müsaviri ile düzenlenecek tutanak ve tespit sözlesmelerinin imzalanmasi tespit sözlesmelerinin yenilenmesi Fesh edilmesi, Antrepo stok kayitlarinin tutulmasi, Tespit islemleri ve Gümrük Denetlemelerinde Antrepo yetkilisi olarak Otokar Otomotiv ve Savunma San. A.S firmasini temsil etmek, Fabrikaya giren Tüm Ithal malzemelerin sorunsuz ve eksiksiz olarak teslim alinmasi Ambar bölgelerine malzemelerin teslim edilmesinin saglanmasi, Yil sonu sayim programinin sistemsel hareketlerinin yapilmasi., beyaz yaka sayim listelerinin sistemsel olarak olusturulmasi, envanter etiket ve listelerin basimi., Envanter blokaj islemlerinin yapilmasi., Kamyon üretiminin verimi ve devamliligi için gereken malzeme besleme sürecini yönetmek., Kamyon kit stoklarinin takibini saglamak ve hat besleme öncesi kit açilimi adresleme gibi konularda görev yapan ekibi yönetmek., Kamyon kit eksiklerinin ve olusan acil durumlarin hat verimliligini etkilemeden çözümüne yönelik bilgi akisini saglamak.nbsp, • Sazcilar ve konsinye depolarin stoklarinin yönetmek. Bu amaç için çalisan ekibin sevk ve idaresini saglamak., • Sazcilar ve konsinye depolarindan yapilacak üretim beslemelerinin zamaninda ve eksiksiz olarak yapilmasini saglamak., • Sorumlu oldugu depolarda gerekli stok sayimlari için is planlarinin yapilmasini saglamak., • Red ve Claim süreçlerinde gerekli aksiyonlarin alinmasi için ekibin sevk ve idaresini saglamak., • Siparis fazlasi malzemelerin iadesini saglatmak., • Islenmek üzere gönderilecek malzemelerin sevkini saglatmak., • Claim ve islenmek üzere gönderimlerinden kaynaklanan firma anlasmazliklari ve fatura süreçlerinin çözümünü saglamak., Çevik çalisma metodolojisinin gerekliliklerinin (daily, sprint planlama, review vb.) yerine getirilmesini saglamak., ";KAAN KESKIN
010759;GLOBAL SATIS SONRASI TEDARIK ZINCIRI LID;GLOBAL SATIS SONRASI TEDARIK ZINCIRI LID;Satis Sonrasi Hizmetler Alaninda Müsteri Ihtiyaçlarini Dogru Zamanda Dogru Miktarda Ve Hedeflenen Fiyatta Otokar Kalitesine Ve Süreçlerine Uygun Sekilde Temin Ederek Maliyetlerin Düsmesini Desteklemek Ve Müsteri Memnuniyetini Maksimize Etmek;"Fatura onaylama yetkisi
Siparis ve teklif onaylama yetkisi 
Navlun degisikligi onaylama yetkisi
Maliyet/fiyat onay stratejilerinde yetki";" Yedek parça için gerekli olup direk satinalmasi yapilan parçalarin yurtiçi ve yurtdisi tedarikçi firmalardan temini lojistik ve ithal parçalar için ithalat süreçlerinin takip edilmesi, Yurtdisindan satin alinan parçalar için tedarikçi nakliyeci ve gümrük müsavirligi firmalariyla ithalat islemleri için gerekli koordinasyonun saglanmasi, Satin alma yapilan firmalar için Satin alma sözlesmelerinin ve fiyat eskalasyonlarinin yapilmasi, Yurtdisi ve yurtiçi tedarikçi firmalar ile yazili ve sözlü olarak iletisimin saglanmasi, Satistan gelen özel fiyat talepleri için fiyat tekliflerinin toplanmasi, Satin alma yapilan firmalar için siparis planlamalarinin yapilmasi ve sistemde siparislerin olusturulmasi, Firmalarla garanti ve claim süreçlerinin yürütülmesi, Sevkiyatlarin hedeflenen zamanda tedarik edilmesi için gerekli takibin yapilmasi ve aksiyonlarin alinmasi, Satin alma lojistik operasyonlarinda iyilestirici/gelistirici faaliyetlerinin yürütülmesi, Tedarik süreleri ve minimum siparis adeti iyilestirmeleri, Fiyat ve teslim süresi analizleri, Firmaya saglanan kutu ve etiketler için gerekli organizasyonun yapilmasi,  Yedek parça için gerekli olup direk satinalmasi yapilan parçalarin yurtiçi ve yurtdisi tedarikçi firmalardan temini lojistik ve ithal parçalar için ithalat süreçlerinin takip edilmesi, Yurtdisindan satin alinan parçalar için tedarikçi nakliyeci ve gümrük müsavirligi firmalariyla ithalat islemleri için gerekli koordinasyonun saglanmasi, Satin alma yapilan firmalar için Satin alma sözlesmelerinin ve fiyat eskalasyonlarinin yapilmasi, Yurtdisi ve yurtiçi tedarikçi firmalar ile yazili ve sözlü olarak iletisimin saglanmasi, Satistan gelen özel fiyat talepleri için fiyat tekliflerinin toplanmasi, Satin alma yapilan firmalar için siparis planlamalarinin yapilmasi ve sistemde siparislerin olusturulmasi, Firmalarla garanti ve claim süreçlerinin yürütülmesi, Sevkiyatlarin hedeflenen zamanda tedarik edilmesi için gerekli takibin yapilmasi ve aksiyonlarin alinmasi, Satin alma lojistik operasyonlarinda iyilestirici/gelistirici faaliyetlerinin yürütülmesi, Tedarik süreleri ve minimum siparis adeti iyilestirmeleri, Fiyat ve teslim süresi analizleri, Firmaya saglanan kutu ve etiketler için gerekli organizasyonun yapilmasi,  • Etkin maliyet yönetimine öncülük etmek. Sadece SSH organizasyonundaki ekipleri degil iliskide olunan tüm ekipleri de ayni amaç etrafinda hizalamak., • Fiyat ve termin süresi analizleri yapip iyilestirmeye açik alanlari tespit ederek aksiyon alinmasini saglamak, • Esakalayona dayali fiyat artis modeline göre çalisan tedarikçi sayisini artirmak bu kapsamda fabrika maliyet ekipleriyle koordine çalismak, • Alternatif yedek parça çalismalarina öncülük etmek servis bayi müsteri taleplerini analiz ederek periyodik olarak takibini ve raporlamasini saglamak, • Satinalma KPIlarini olusturmak güncelligini saglamak ve raporlamak, • Ekip içerisinde ve iliskili ekiplerde ihtiyaç duyulan noktalarda danismanlik hizmeti vermek, • Teklif fiyat analizleri  yaparak maliyeti minimize edecek optimal süreç tasarimlari olusturmak. Tedarikçi ve sirket arasinda kurumsal bir bag olusturmasina önderlik etmek, • Sadece Türkiye içerisinde degil global olarak da etkin tedarik zinciri yönetimini saglamak.  Birim maliyet  Zaman  Ek maliyetler  basliklarina göre tedarik kaynagi analizleri yaparak global bakis açisiyla yeni firsatlari görmek ekipleri bu firsatlara göre koordine etmek., • Satinalma süreçlerinde dijitalizasyonun saglanmasi entegre sistemselerin çogaltilmasi sistemsel takibin kolaylastirilmasi için yeni projelere aktif katilim saglamak yeni fikirler üretmek ve sistemselerin devreye alinmasini saglamak, • Satinalma ekibinin organizasyon hedefleriyle entegre çalisiyor olmasini ve kontrolünü saglamak., • Ekibin Agile is modelinde göre çalismasini saglamak etkin JIRA yönetimini gerçeklestirmek ve kullanimini  ekip içerisinde yayginlastirmak, • Ekip içerisinde hem ise yönelik hem de bireysel performans ölçümleri yaparak geri bildirimler ile aktif etkilesim saglamak. Is yogunlugunu ve dar bogazlari tespit ederek gerekli is gelistirmeleri saglamak, • Ekip içi iletisim ve etkilesimi maksimize etmek. Güvenli seffaf iletisime açik çalisma alani kurmak ve sürdürülebilirligini saglamak, Çevik çalisma metodolojisinin gerekliliklerinin (daily, sprint planlama, review vb.) yerine getirilmesini saglamak., ";BUKET KAHYA UYSAL
010866;PLANLAMA, TESIS LOJ & IHRACAT OPER LID;PLANLAMA, TESIS LOJ & IHRACAT OPER LID;"Sirketin ve Holding’in operasyon verimlilik ve karlilik hedefleri dogrultusunda ulusal/uluslararasi mevzuatlara uyum içinde Ihracat islemlerinin (bedelli – bedelsiz - geçici ihracat ( test  tamir amaçli) -fuar  vs.) hedeflenen takvimde tamamlanmasini organize etmek  ";"ihracat sürecinin planlamasi ve yürütülmesi  Ekip Yönetimi Tedarik zinciri Koordinasyonu  Maliyet ve Optimizasyon Yasal ve denetim süreçlerine katki  nakliye ve lojistik organizasyonu gümrük islemleri takibi evrak yönetimi Lojistik bütçenin yönetimi olusturulmasi ";" • Sirketin ve Holding’in operasyon verimlilik ve karlilik hedefleri dogrultusunda ulusal/ulusararasi mevzuatlara uyum içinde Ihracat islemlerinin (bedelli – bedelsiz - geçici ihracat ( test  tamir amaçli) -fuar  vs.) hedeflenen takvimde tamamlanmasini organize etmek, Proje nitelikli ihracat sevkiyatlarinda  is emri gelmeden minimum bir ay önce gereken ön hazirliklari (taslak evraklarin kontrolü öngörüsel navlun teklifleri vb.) gerçeklestirmek. Is emrinin isleme alinmasi esnasinda ise süreci hizli ve eksiksiz olarak yürütmeyi saglamak, Ihracat konusunda devlet ve özel kuruluslarla ilgili alinmasi gereken izin/belge vs süreçlerinin takibi ve temaslarini gerçeklestirmek, Ihraç edilecek ürünlerin sevk öncesi lojistik (iç –dis)  gümrükleme prosedür ve diger hazirliklarinin organizasyonu kontrol etmek.  Yapilan ihracat sevkiyati öncesi organizasyonun müsteri memnuniyeti göz önünde bulundurarak gerçeklestirilmesini saglamak, Mal bedelleri ve benzeri tahsilat islemlerini Finans ve Mali Isler Departmanlari ile birlikte yürütmek gerektiginde istenen belgelerin düzenlenmesini saglayarak ve ilgili kurum ya da departmanlara iletmek, Satis departmanlarindan gelen akreditifleri kontrol etmek  eksiklikleri ve degisiklikleri satis grubuna bildirmek  ilgili L/C’ye bagli olarak gelen yükleme detaylarinin ve evraklarinin akreditifle uyumlu olarak bankaya iletilmesini saglamak., Satis departmanlari ile mutabik kalarak Ihracat müsterileriyle ihracatin sorunsuz ve zamaninda gerçeklesmesi amaci ile gerektiginde temasta bulunup müsteri taleplerinin eksiksiz sekilde yürütülmesini saglamak. Iç ve dis müsteri memnuniyetini azami seviyede tutacak aksiyonlar alarak ihracat hedeflerinin gerçeklesmesine ait katki ve katma deger yaratmak, Ihracat süreçlerinde çalisilan paydas firmalardan (gümrük müsavirinakliye firmalari ve sigorta firmalari vb.) gelen faturalarin dogrulugunu kontrol edip faturalarin eksiksiz bir sekilde isleme alinmasini saglamak. Iletilen faturalara ait harcamalarin anilan paydaslarla yapilan anlasmalara uygun sekilde yapilmasini saglamak, Ihale teklif asamasinda veya sözlesme imza sürecinde taahhütlerin ihracat operasyon açisindan yürütülebilir olmasi için gerekli görüslerin satis departmani ve sözlesme yönetim birimine aktarilip birebir uygulamasinin saglanmasi, Ihracat Operasyon / Lojistik süreçlerine ait  kurumsal hafizasinin dijital ortama aktarilma süreçlerinin olusturulmasini saglamak, Ihraç kayitli teslimlerde ürünlerin ihracat edildigine dair tüm ihracat operasyon ve dökümantasyon sürecinin  kontrolü  ve intaçlarinin takibini saglamak, Sirket içi prosedür ve Kalite Belgesi ile ilgili çalismalarin organizasyonu gereken belgelerin düzenlenmesini saglamak. Sorumluluk alanindaki çalismalarin Çevre Enerji Is Sagligi ve Güvenligi ile ilgili talimat ve kurallara uygun yapilmasini ilgili birimler ile koordineli olarak gerekli önleyici tedbirlerin alinmasini ve gelisimini saglamak, Ihracat operasyon süreçlerinin YYS kapsaminda ISO 27001 talimatlarina göre kontrolleri ve bilgi güvenligi standartlarina uygunlugunu saglamak, Çalisanlarin görevlerini verimli bir sekilde ve zamaninda yapmalari amaciyla  islerin dagilimini yapmak. çalisanlari takip etmek  egitmek ve yönlendirmek. is süreçlerine yönelik ekibin performans hedeflerini belirlemesine destek olmak ve izlemek., Ihracat Operasyon islemleri bazinda  resmi kurum ve kuruluslar ile müsteri tabani çerçevesindenbsp span style color: rgb(132 100 70) font-family: Calibri Tahoma quotSpecial Elitequot SpecialElite quotCourier Newquot Courier quotLucida Sans Typewriterquot quotLucida Typewriterquot monospace font-size: 14px background-color: rgb(250 245 231)  sirketi temsil etmek. Sirket amaç ve hedeflerin belirlenmesinde görev almak /span, Yürürlükteki ihracat mevzuatina gore islemlerin uygun  dogru ve zamaninda gerçeklesmesi için  resmi yayinlari  bildirileri günlük olarak takip etmek  degerlendirmek  bilgilendirmek ve raporlamak. Gelecekte yapilabilecek  mevzuat degisiklikleri için yetkililerle temasta olmak. Gümrük dis ticaret ve ilgili tüm resmi mevzuatlardaki degisikliklerin takibi  ve etkilerini degerlendirerek gerekli önlemlerin alinmasi üst yönetimi bilgilendirmek., • Sirketin ve Holding’in operasyon verimlilik ve karlilik hedefleri dogrultusunda ulusal/ulusararasi mevzuatlara uyum içinde Ihracat islemlerinin (bedelli – bedelsiz - geçici ihracat ( test  tamir amaçli) -fuar  vs.) hedeflenen takvimde tamamlanmasini organize etmek, Proje nitelikli ihracat sevkiyatlarinda  is emri gelmeden minimum bir ay önce gereken ön hazirliklari (taslak evraklarin kontrolü öngörüsel navlun teklifleri vb.) gerçeklestirmek. Is emrinin isleme alinmasi esnasinda ise süreci hizli ve eksiksiz olarak yürütmeyi saglamak, Ihracat konusunda devlet ve özel kuruluslarla ilgili alinmasi gereken izin/belge vs süreçlerinin takibi ve temaslarini gerçeklestirmek, Ihraç edilecek ürünlerin sevk öncesi lojistik (iç –dis)  gümrükleme prosedür ve diger hazirliklarinin organizasyonu kontrol etmek.  Yapilan ihracat sevkiyati öncesi organizasyonun müsteri memnuniyeti göz önünde bulundurarak gerçeklestirilmesini saglamak, Mal bedelleri ve benzeri tahsilat islemlerini Finans ve Mali Isler Departmanlari ile birlikte yürütmek gerektiginde istenen belgelerin düzenlenmesini saglayarak ve ilgili kurum ya da departmanlara iletmek, Satis departmanlarindan gelen akreditifleri kontrol etmek  eksiklikleri ve degisiklikleri satis grubuna bildirmek  ilgili L/C’ye bagli olarak gelen yükleme detaylarinin ve evraklarinin akreditifle uyumlu olarak bankaya iletilmesini saglamak., Satis departmanlari ile mutabik kalarak Ihracat müsterileriyle ihracatin sorunsuz ve zamaninda gerçeklesmesi amaci ile gerektiginde temasta bulunup müsteri taleplerinin eksiksiz sekilde yürütülmesini saglamak. Iç ve dis müsteri memnuniyetini azami seviyede tutacak aksiyonlar alarak ihracat hedeflerinin gerçeklesmesine ait katki ve katma deger yaratmak, Ihracat süreçlerinde çalisilan paydas firmalardan (gümrük müsavirinakliye firmalari ve sigorta firmalari vb.) gelen faturalarin dogrulugunu kontrol edip faturalarin eksiksiz bir sekilde isleme alinmasini saglamak. Iletilen faturalara ait harcamalarin anilan paydaslarla yapilan anlasmalara uygun sekilde yapilmasini saglamak, Ihale teklif asamasinda veya sözlesme imza sürecinde taahhütlerin ihracat operasyon açisindan yürütülebilir olmasi için gerekli görüslerin satis departmani ve sözlesme yönetim birimine aktarilip birebir uygulamasinin saglanmasi, Ihracat Operasyon / Lojistik süreçlerine ait  kurumsal hafizasinin dijital ortama aktarilma süreçlerinin olusturulmasini saglamak, Ihraç kayitli teslimlerde ürünlerin ihracat edildigine dair tüm ihracat operasyon ve dökümantasyon sürecinin  kontrolü  ve intaçlarinin takibini saglamak, Sirket içi prosedür ve Kalite Belgesi ile ilgili çalismalarin organizasyonu gereken belgelerin düzenlenmesini saglamak. Sorumluluk alanindaki çalismalarin Çevre Enerji Is Sagligi ve Güvenligi ile ilgili talimat ve kurallara uygun yapilmasini ilgili birimler ile koordineli olarak gerekli önleyici tedbirlerin alinmasini ve gelisimini saglamak, Ihracat operasyon süreçlerinin YYS kapsaminda ISO 27001 talimatlarina göre kontrolleri ve bilgi güvenligi standartlarina uygunlugunu saglamak, Çalisanlarin görevlerini verimli bir sekilde ve zamaninda yapmalari amaciyla  islerin dagilimini yapmak. çalisanlari takip etmek  egitmek ve yönlendirmek. is süreçlerine yönelik ekibin performans hedeflerini belirlemesine destek olmak ve izlemek., Ihracat Operasyon islemleri bazinda  resmi kurum ve kuruluslar ile müsteri tabani çerçevesinde sirketi temsil etmek. Sirket amaç ve hedeflerin belirlenmesinde görev almaknbspnbsp, Yürürlükteki ihracat mevzuatina gore islemlerin uygun  dogru ve zamaninda g";YASEMIN SÖNMEZ
