SicilNo;Birim;Mudurluk;Amac;Yetki;AnaSorumluluks
000236;TIC. ARÇ. MÜHENDISLIK PROJE YÖNETIM MÜD.;TIC. ARÇ. MÜHENDISLIK PROJE YÖNETIM MÜD.;"Proje ve UVP bütçe takip ve yönetimi ile birlikte proje araç maliyet çalismalari yaparak sirketin belirlemis oldugu maliyet hedeflerinin gerçeklesmesinin saglanmasi. ";TA Proje ve Kaynak Yönetimi Müdürünün yönlendirmeleri ile çalisir.;" 1. Fiyat yenileme çalismalarinda tedarikçilerle görüserek fiili maliyet analizleri teklif karsilastirmalari veya fiyat artis etüdlerine göre fiyat belirleme çalismalari yapmak., 2. Yenilenen fiyatlari ve döviz bazli degisen fiyatlari sisteme girerek gelen faturalarin anlasilan fiyata uygunlugunu kontrol etmek, 3. Tedarikçilerin gönderdigi maliyet analizlerini incelemek gerek görülürse yerinde zaman ve is etüdü ve malzeme sarf tespitlerini kontrol etmek., 4. Standart ve özel araçlarin malzeme maliyet analizlerini hazirlamak., 5. Periodik olarak ( aylik olarak ) malzeme birimi yan sanayii fiyat artis raporlarini hazirlamak, 6. Hedef olarak verilen ucuzlatma çalismalari ile ilgili faaliyetlerde bulunmak ve yerlilestirme çalismalarina destek olmak. Yeni malzemeler için tedarikçi arastirmak ve fiyat teklifleri toplamak, 7. Satinalma sözlesmelerinin takip sistemiyle ilgili çalismalar yapmak sözlesmeleri hazirlamak ve tedarikçiler ile gerekli koordinasyonu saglamak., 8. Araç parçalariyla ilgili fiyat tespiti yaparak sirket içi ilgili birimlere bilgi sunmak, 9. Dönemsel bazda sac nakliyesi ile ilgili firmalardan alinan tekliflerin degerlendirilmesi ve sözlesmeyle birlikte devreye alinmasi için gerekli çalismalari yapmak. Nakliyedepolama ve kesim isçilikleri ile ilgili faturalari miktar ve fiyatsal olarak, 10. Ham malzemlerin atil stok degerlendirmelerini yapmak., 130. Proje UVP bütçelerinin hazirlanmasi için ilgili birimler ile koordine olarak takibi ve yönetimini yapar., 131. Mali fizibilite raporlarini hazirlar araçlarin maliyet adam.saat ve satis fiyatlari ile ilgili fizibilite çalismalarini yapar koordine eder. Belirlenen süreçlerde kontrol ve takip faaliyetlerini yürütür. Bu faaliyetleri yürütmesi için ihtiyaç duyacagi maliyete etki edecek makro degisiklikleri ve araç speklerini Sistem Direktörlügünden temin eder., 132. Yeni türev ve ihale araçlarinin maliyet hesaplamalarini satin alma ile koordineli olarak yapar. Araç yasam döngüsü içinde maliyet kontrolünü gerçeklestirir. Bu konuyla ilgili spek ve temel maliyet add-delete dokümanlarini ve baz araç kodunu Sistem Direktörlügü’nden alir., 133. Ucuzlatma projeleri için öncelikli konulari Sistem Direktörlügü ve Mühendislik Direktörlügüne bagli ilgili birimler ile birlikte belirler ve ilgili koordinasyon faaliyetlerini yönetir., 134. Üst yönetimin talep ettigi araçlar için deger ve fiyatlandirma analizleri yapar. Araçlarin müsteri beklentilerine en uygun hale getirilerek pazarda basarili bir ürün olmasi için ilgili departmanlarla gerekli koordinasyonu faliyeti yürütür yönetir., Çevik çalisma metodolojisinin gerekliliklerinin (daily, sprint planlama, review vb.) yerine getirilmesini saglamak., "
000494;TIC ARÇ GÖVDE YAP MEKANIK SIST LIDERLIGI;TIC. ARAÇLAR MÜH. GRUP DIREKTÖRLÜGÜ;Tasarim prosedürlerine uygun olarak araç yayinlarinin hazirlanmasi yeni ürün gelistirme mevcut ürün iyilestirme projelerinde arastirma ve  teknik resim çalismalarinin yapilmasi.;Yönetici yönlendirmesi dogrultusunda çalisir;" 1. Yeni ürün gelistirme yada iyilestirme projeleri ile ortaya çikan üretilebilir araç speklerini yayinlamak ve gerekli etüd ve resim çalismalarini yapmak., 2. Yeni ürün gelistirme ya da mevcut ürün iyilestirme projelerinde teknik resimleri ve  malzeme speklerini çikarmak ve  BOM sayfalarini hazirlamak., 3. Müsteri isteklerini karsilayacak yeni ürün gelistirme yada iyilestirme projeleri için teklif çalismalarini gerçeklestirmek, 4. Yeni ürün gelistirme projelerinde prototip ürünlerin üretim asamalarinda bulunarak kontrollerini yapmak. Uyumsuzluklari gidermek ve resimleri revize etmek., 5. Kendi alanindaki ürünlerle ilgili olarak teknolojik gelismeleri izlemek rakip ürünlerin arastirma çalismalarini yapmak., 6. Yeni ürün gelistirme yada iyilestirme projeleri ile ortaya çikan ürünlerle ilgili üretebilirlik esaslarini incelemek uyumsuzluklarin düzeltmek ve gerekli revizyonlari yapmak, 7. Mevcut ürünler üzerinde kalite iyilestirme maliyet düsürme ve performans gelistirme çalismalari yapmak.,  1.Arge Direktörlügü sorumlulugundaki tüm araç ve ürünlerin iyilestirme ucuzlatma ve kalite problemlerini yürütmek., 2. Seri Yeni ürün gelistirme yada iyilestirme projeleri ile ortaya çikan ürünlerle ilgili gövde iliskili sapma taleplerini incelemek ve sapma azaltici tedbirlerin alinmasini saglamak., 3. Ar-Ge çalismalari kapsaminda saha incelemelerini yapmak ve iyilistirmeleri tasarlamak, 4. Yeni araç için tasarim mevcut araç için gelistirme yapilan komple veya parçanin taslak çalismalarini yapmak., 5. Ilk numuneyi temin etmek veya ettirmek numuneyi prototipe uygulamak., 6. Olumlu bulunan projeyi teknik resim haline dönüstürmek yayina hazir hale getirmek., 7. Yeni ürün gelistirme yada iyilestirme çalismalari sonrasinda komple proje numaralarini (T projeler) tespit ederek araç ana resimlerini dosyalamak., Çevik çalisma metodolojisinin gerekliliklerinin (daily, sprint planlama, review vb.) yerine getirilmesini saglamak., "
000709;YOLCU GRUBU YURT IÇI VE ÇEV ÜLK SAT TAK;GMY TICARI ARAÇLAR;Sirketin belirlenen hedef ve politikalari dogrultusunda sirketin satis ve pazarlama faaliyetlerinin yürütülmesi.;Üst birimin yönlendirmesi il çalisir.;" 1. Yillik satis programi ve kendisine verilen hedefler dogrultusunda satislarini gerçeklestirebilmek için gerekli iç müsteri temaslarini kurmak teklif vermek takibini yapmak ve sonuçlandirmak., 2. Pazardaki rakiplerle ilgili verileri Rekabet Mevzuatina uygun mesru kaynaklardan toplayarak sirketin dogru bir sekilde spesifikasyon belirleme fiyatlandirma ve satis politikasini olusturmasina yardimci olmak., 3. Piyasa arastirmasi yapmak pazar ihtiyacini saptamak ve dönemsel satis tahminlerini olusturacak verileri Pazarlama Yöneticisine iletmek ve pazar yaratilmasina katkida bulunmak., 4. Müsteri performans sisteminin olusturulmasina yönelik verileri saglamak., 5. Müsterilerle iliskilerin canli tutulmasi ve gelistirilmesi için kendisine verilen hedefler dogrultusunda dönemsel ziyaretler tertip etmek, 6. Sirketin belirlenen standartlar dogrultusunda bayilerle olan iliskilerini yürütmek, 7. Araç siparisinden itibaren teslimata kadar olan süreci koordine etmek., 8. Ürünlere müsteri ve Pazar ihtiyaçlarinin yansitilmasi amaciyla, ürün gelistirme çalismalarina katilmak.,  1. Yillik satis programi ve kendisine verilen hedefler dogrultusunda satislarini gerçeklestirebilmek için gerekli iç müsteri temaslarini kurmak teklif vermek takibini yapmak ve sonuçlandirmak., 2. Pazardaki rakiplerle ilgili verileri Rekabet Mevzuatina uygun mesru kaynaklardan toplayarak sirketin dogru bir sekilde spesifikasyon belirleme fiyatlandirma ve satis politikasini olusturmasina yardimci olmak., 3. Piyasa arastirmasi yapmak pazar ihtiyacini saptamak ve dönemsel satis tahminlerini olusturacak verileri Pazarlama Yöneticisine iletmek ve pazar yaratilmasina katkida bulunmak., 4. Müsteri performans sisteminin olusturulmasina yönelik verileri saglamak., 5. Müsterilerle iliskilerin canli tutulmasi ve gelistirilmesi için kendisine verilen hedefler dogrultusunda dönemsel ziyaretler tertip etmek, 6. Sirketin belirlenen standartlar dogrultusunda bayilerle olan iliskilerini yürütmek, 7. Araç siparisinden itibaren teslimata kadar olan süreci koordine etmek., 8. Ürünlere müsteri ve Pazar ihtiyaçlarinin yansitilmasi amaciyla, ürün gelistirme çalismalarina katilmak., Çevik çalisma metodolojisinin gerekliliklerinin (daily, sprint planlama, review vb.) yerine getirilmesini saglamak., "
000727;TIC. ARAÇLAR SISTEM MÜH. VE PLATFORM DIR;TIC. ARAÇLAR SISTEM MÜH. VE PLATFORM DIR;Yayinlanan günlük haftalik ve aylik üretim programina uygun olarak üretimin gerçeklesmesinin saglanmasi ve raporlanmasi.;Müdürünün talimat ve onayi çerçevesinde çalisir.;" 1. Günlük üretim programinin hedeflenen zaman ve kalitede gerçeklesmesi için ekiplerin kordinasyonunu saglamak., 2. Günlük bant durum takip listelerinin hazirlanmasi raporlanmasi ve takibinin yapilmasini saglamak., 3. Ürün mühendisliginin ve Arge’nin yayin bildirimleri ve operasyon sayfalarina uygun olarak araçlarin üretilmesini saglamak üretim sirasinda ortaya çikan sorunlari gerekli birimlere bildirmek ve takibini yapmak., 4. Is emirlerinin zamaninda kapatilmasini saglamak ve stok sapmalarini engellemek., 5. Birim  ünite bazinda brüt ve net verimliligi tutturmak ve iyilestirmek ., 6. Sorumluluk alanindaki çalismalarin is güvenligi kurallarina uygun yapilmasini saglamak tespit edilen uygunsuzluklari kapatmak ve risk degerlendirmelerinin güncelligini saglamak için ISG Birimi ile birlikte çalismak., 7. Sorumluluk alaninda meydana gelen is kazalarinin analiz edilip kazalarin tekrarlamamasi ve gerekli önlemlerin alinmasi için  Üretim ve Tesis Mühendislik ISG Birimi ve ilgili birimler  ile birlikte çalismak., 8. Fabrika düzen ve intizaminin isçi  kilik ve  kiyafetinin istenilen düzgünlükte ve temizlikte olmasini saglamak., 9. Çalisanlarin günlük puantajlarini ve çalistiklari isleri düzenli takip etmek ve raporlamak., 10. Üretim ve ürün maliyetini azaltici kalite artirici iyilestirme faaliyetleri gerçeklestirmek,  1. Prototip üretimlerinde kullanilacak üretim teknolojilerinin arastirilarak uygulanmasina yönelik mühendislik çalismalarinin yapilmasi ve yeni teknolojilerinüretim sürecine kazandirilmasi, 2. Prototip üretim için gereken altyapi yatirimlarinin belirlenmesi planlanmasi bütçelenmesi ve altyapi ihtiyaçplani çerçevesinde gerçeklestirilmesi., 3. Prototip çalismalarina üretilebilirlik açisindan destek verilmesi üretilebilirligi ve verimliligi arttiracak geri bildirimlerin saglanmasi yoluyla tasarim ve üretim etkinliginin arttirilmasi, 4. Prototip üretim proseslerinin yeni teknolojiler kazanilarak tasarlanmasi metodnbsp ve üretim mühendisligi çalismalarinin üretim ve kalite ile birlikte yapilmasi. proses ve kalifikasyonlarinin gerçeklestirilmesine destek verilmesi, 5. Prototip Araçlarin homoglasyon test gereksinimleri için gerekli teknolojilerin arastirilmasi uygulanmasina yönelik mühendislik çalismalarinin yapilmasi ve homoglasyon hazirlik sürecine kazandirilmasinbspnbsp, 6. Prototip üretimlerinin hedeflenen süre ve maliyet ile gerçeklestirilmesi, 7. Sorumluluk alaninda meydana gelen is kazalarinin analiz edilip kazalarin tekrarlamamasi ve gerekli önlemlerin alinmasi için  Üretim ve Tesis Mühendislik ISG Birimi ve ilgili birimler  ile birlikte çalismak., 8. Tasarim çalismalarina paralel olarak üretim proseslerinin sürekli gelistirilmesi prototip üretimi sonunda seri üretime hazir üretim bilgi paketinin olusmasinin saglanmasi. Prototip üretimden edinilen deneyim ile seri üretimin verimli ve düsük maliyetli gerçeklestirilmesine yönelikmühendislik çalismalarinin yürütülmesi, 9. Sorumluluk alaninda meydana gelen is kazalarinin analiz edilip kazalarin tekrarlanmamasi ve gerekli önlemlerin alinmasi için ISG ve ilgili birimler ile koordineli çalismak. Çalisanlarin günlük puantajlarini ve çalistiklari isleri düzenli takip etmek ve raporlamak., 10. Sorumluluk alanindaki çalismalarin ve is güvenligi kurallarina uygun yapilmasini saglamak. tespit edilen uygunsuzluklarikapatmak Risk degerlendirmelerinin güncelligi için ISG ile birlikte çalismak. Sorumluluk alanlarindaki çalismalarinin Çevre Enerji Is Sagligi ve güvenligi ile ilgili talimat ve kurallara uygun yapilmasini ilgili birimler ile koordineli olarak gerekli önleyici tedbirlerin alinmasini ve gelisimini saglamak, Çevik çalisma metodolojisinin gerekliliklerinin (daily, sprint planlama, review vb.) yerine getirilmesini saglamak., "
000760;TIC. ARAÇLAR MÜH. GRUP DIREKTÖRLÜGÜ;TIC. ARAÇLAR MÜH. GRUP DIREKTÖRLÜGÜ;"Ticari araçlarin  gövde ve gövde sistemlerinin  tasarimi. ";"TEP04201 Tasarim prosedürü TET04201 Ürün siniflandirma talimati TET04202 Prototip hazirlama ve yönetimi talimati TET04203 Tasarim planlama talimati TET10201 Prototip test talimati TSE Standartlari ISO Standartlari DIN Standartlari ve BLS Standartlari çerçevesinde çalisir ";"1. Temel özellikleri belirlenmis ticari araç projelerinin CAD yazilimi kullanarak modellenmesi ve detay çalismalarinin  yapilmasini saglamak., 2. Proje çerçevesindeki prototiplerin olusturulabilmesi için gerekli malzeme teminini saglamak prototipleri hazirlamak amaca uygunlugunu kontrol etmek ve uygunsuzluklari gidermek., 3. Yeni ürün gelistirme yada iyilestirme projeleri ile ortaya çikan ürünlerle ilgili sapma taleplerini incelemek ve sapma azaltici tedbirlerin alinmasini saglamak., 4. Prototip testlerinde ortaya çikan problemlerin giderilmesini saglamak., 5. Motorlu Araçlar Tip Onay Yönetmeligine ve regülasyon  programina göre yapilmasi gereken çalismalari yürütmek/yürütülmesini saglamak., 6.  Birim çalisanlarinin egitim ihtiyaçlarini belirlemek ve gelisim planlarini yapmak., 7.  Birim bünyesinde gerçeklestirilen projeleri denetleyerek  zamaninda belirlenen mali teknik hedefler içinde bitirilmesini saglamak., 8. Gövde sistemlerinin ve parçalarinin yayinlarini yaptirmak ve araç parça listelerinin olusturulmasini saglamak., Çevik çalisma metodolojisinin gerekliliklerinin (daily, sprint planlama, review vb.) yerine getirilmesini saglamak., "
000776;GMY TICARI ARAÇLAR;GMY TICARI ARAÇLAR;Sirketin ticari araç satis ve pazarlama politikasinin olusumuna katkida bulunulmasi ve satis hedeflerinin realize edilmesinin saglanmasi.;Ilgili prosedür ve talimatlar ihale mevzuati özel sartnameler ve karayollari / trafik kanunlari çerçevesinde çalisir.;" 1.	Tüm yurt içi ihalelerinin (Kamu kuruluslari DMO vb.) takibi ve bu ihalelere ait dosyalarini hazirlamak ihalelere katilimin saglamak fiyatlarini hazirlamak onaylatmak pazarliklari ve sözlesmeleri yapmak., 2.	Kamu kuruluslarina satilan araçlarin teslimatlarinin ilgili sözlesme hükümlerine göre ve zamaninda yapmak., 3.	Kamu alacaklarinin takibi ve araç bedellerinin zamaninda alinmasinin saglanmasi.Verilmis teminat mektuplarinin takibi ve islevi bitenlerin geri alinmasini temin etmek., 4.	Araç vergileri ile ilgili   OSD ve  Maliye Bakanligindaki gelismeleri takip etmek ilgili toplantilarda sirketi temsil etmek ve bu konudaki çalismalara katilmak., 5.	Bütçe Kanunlarini inceleyerek yeni bütçe yili içinde araç alacak kuruluslari tespit etmek ve bu kuruluslari yil içinde periyodik olarak ziyaret ederek araç konusunda bu kuruluslari Otokar’a yönlendirmek., 6.	Üretim ve satislarla ilgili OSD DIE ye fiyatlarla ilgili DMO ve Sanayi Bakanligina aylik bildirimlerde bulunmak., 7.	Ülke çapinda araç alma potansiyeli bulunan belediyeleri düzenli olarak ziyaret etmek. Araç alabilecek belediyelerin Ankara’dan kredilerinin çikartilmasini saglamak Bakanlar Kurulu Kararlarini çikartmak DMO daki islemlerini takip etmek., 8.	Ihale disi direkt müsteri satislarini gerçeklestirmek., 9.	Satis hedeflerine ulasabilmek amaciyla pazar analizi müsteri istekleri rakip firma araç takipleri ürün fiyat tespiti ve performanslarinin takipleri ile ilgili çalismalari organize etmek., 10.	Sirket ürünleri ile ilgili veri bankasi olusturmak ve bunlarin dokümantasyonunu saglamak., 11.	Araç tanitimlari yapmak Fuarlara (Belediye ve Kamu ile ilgili olan) katilmak tanitim için direct mail uygulamak ve sonuçlarina göre ziyaretler yapmak.,  1. Tüm yurt içi ihalelerinin (Kamu kuruluslari DMO vb.) takibi ve bu ihalelere ait dosyalarini hazirlamak ihalelere katilimin saglamak fiyatlarini hazirlamak onaylatmak pazarliklari ve sözlesmeleri yapmak., 2. Kamu kuruluslarina satilan araçlarin teslimatlarinin ilgili sözlesme hükümlerine göre ve zamaninda yapmak., 3. Kamu alacaklarinin takibi ve araç bedellerinin zamaninda alinmasinin saglanmasi.Verilmis teminat mektuplarinin takibi ve islevi bitenlerin geri alinmasini temin etmek., 4. Araç vergileri ile ilgili   OSD ve  Maliye Bakanligindaki gelismeleri takip etmek ilgili toplantilarda sirketi temsil etmek ve bu konudaki çalismalara katilmak., 5. Bütçe Kanunlarini inceleyerek yeni bütçe yili içinde araç alacak kuruluslari tespit etmek ve bu kuruluslari yil içinde periyodik olarak ziyaret ederek araç konusunda bu kuruluslari Otokar’a yönlendirmek., 8. Ihale disi direkt müsteri satislarini gerçeklestirmek., 9. Satis hedeflerine ulasabilmek amaciyla pazar analizi müsteri istekleri rakip firma araç takipleri ürün fiyat tespiti ve performanslarinin takipleri ile ilgili çalismalari organize etmek., 10. Sirket ürünleri ile ilgili veri bankasi olusturmak ve bunlarin dokümantasyonunu saglamak., 11. Araç tanitimlari yapmak Fuarlara (Belediye ve Kamu ile ilgili olan) katilmak tanitim için direct mail uygulamak ve sonuçlarina göre ziyaretler yapmak., Ülke çapinda araç alma potansiyeli bulunan belediyeleri düzenli olarak ziyaret etmek. DMO daki islemlerini takip etmek., Sorumluluk bögesinde araç alma potansiyeli bulunan kurumlarin/müsterilerin ((Yurtiçi  tüm kamu kurum/kuruluslari ile Gürcistan Azerbaycan Türkmenistan Özbekistan Kirgizistan Tacikistan ve Kazakistan’daki ticari araç kullanicilari) düzenli olarak ziyaret edilmesinin saglanmasi., rumluluk bölgelerindeki ihalelerinin takibinin saglanmasi., gun olan ihalelere/alimlara katilimin saglanmasi., slimatlarinin ilgili sözlesme hükümlerine göre ve zamaninda yapilmasinin saglanmasi., acaklarinin takibinin ve araç bedellerinin zamaninda alinmasinin saglanmasi., rilmis teminat mektuplarinin takibi ve islevi bitenlerin zamaninda geri alinmasinin saglanmasi, rtiçin bütçe kanunlarinin takibinin araç alacak kuruluslarin tespit edilmesinin ve bu kuruluslari yil içinde periyodik olarak ziyaret edilerek Otokar’a yönlendirilmesinin saglanmasi., tis hedeflerine ulasabilmek amaciyla pazar analizi müsteri istekleri rakip firma araçlari ve performanslarinin takiplerinin saglanmasi., aç tanitimi için farkli etkinliklerin (fuar katilimi seminer katilimi direct mailing vb.) gerçeklestirilmesinin saglanmasi, reç çiktilarimiz olarak sirket ürünleri ile ilgili veri bankasinin olusturulmasinin ve bunlarin dokümante edilmesinin saglanmasi., rumluluk alanindaki çalismalarin Kalite Çevre Enerji Bilgi Güvenligi Is Sagligi ve Güvenligi ile ilgili talimat ve kurallara uygun yapilmasini ilgili birimler ile koordineli olarak gerekli risk önleyici tedbirlerin alinmasinin ve gelisiminin saglanmasi., KVK Is Birim Sorumlusu sifatiyla Ticari Araçlar Kamu Satislari Direktörlügü ait KVK envanteri ve süreçlerini yönetmek Sirketin KVK politika ve prosedürlerini uygulamak KVK Proje Ekibi ile koordineli olarak gerekli risk önleyici tedbirlerin alinmasini ve gelisimini saglamak., Sorumluluk bögesinde araç alma potansiyeli bulunan kurumlarin/müsterilerin ((Yurtiçi  tüm kamu kurum/kuruluslari ile Gürcistan Azerbaycan Türkmenistan Özbekistan Kirgizistan Tacikistan ve Kazakistan’daki ticari araç kullanicilari) düzenli olarak ziyaret edilmesinin saglanmasi., rumluluk bölgelerindeki ihalelerinin takibinin saglanmasi., gun olan ihalelere/alimlara katilimin saglanmasi., slimatlarinin ilgili sözlesme hükümlerine göre ve zamaninda yapilmasinin saglanmasi., acaklarinin takibinin ve araç bedellerinin zamaninda alinmasinin saglanmasi., rilmis teminat mektuplarinin takibi ve islevi bitenlerin zamaninda geri alinmasinin saglanmasi, rtiçin bütçe kanunlarinin takibinin araç alacak kuruluslarin tespit edilmesinin ve bu kuruluslari yil içinde periyodik olarak ziyaret edilerek Otokar’a yönlendirilmesinin saglanmasi., tis hedeflerine ulasabilmek amaciyla pazar analizi müsteri istekleri rakip firma araçlari ve performanslarinin takiplerinin saglanmasi., aç tanitimi için farkli etkinliklerin (fuar katilimi seminer katilimi direct mailing vb.) gerçeklestirilmesinin saglanmasi, reç çiktilarimiz olarak sirket ürünleri ile ilgili veri bankasinin olusturulmasinin ve bunlarin dokümante edilmesinin saglanmasi., rumluluk alanindaki çalismalarin Kalite Çevre Enerji Bilgi Güvenligi Is Sagligi ve Güvenligi ile ilgili talimat ve kurallara uygun yapilmasini ilgili birimler ile koordineli olarak gerekli risk önleyici tedbirlerin alinmasinin ve gelisiminin saglanmasi., Sorumluluk bögesinde araç alma potansiyeli bulunan kurumlarin/müsterilerin (MENA ROW) düzenli olarak ziyaret edilmesinin saglanmasi., rumluluk bölgelerindeki ihalelerinin takibinin saglanmasi., gun olan ihalelere/alimlara katilimin saglanmasi., slimatlarinin ilgili sözlesme hükümlerine göre ve zamaninda yapilmasinin saglanmasi., acaklarinin takibinin ve araç bedellerinin zamaninda alinmasinin saglanmasi., rilmis teminat mektuplarinin takibi ve islevi bitenlerin zamaninda geri alinmasinin saglanmasi, tis hedeflerine ulasabilmek amaciyla pazar analizi müsteri istekleri rakip firma araçlari ve performanslarinin takiplerinin saglanmasi., aç tanitimi için farkli etkinliklerin (fuar katilimi seminer katilimi direct mailing vb.) gerçeklestirilmesinin saglanmasi, reç çiktilarimiz olarak sirket ürünleri ile ilgili veri bankasinin olusturulmasinin ve bunlarin dokümante edilmesinin saglanmasi., Sorumluluk bölgesinde araç alma potansiyeli bulunan kurumlarin/müsterilerin düzenli olarak ziyaret edilmesinin saglanmasi., Sorumluluk bölgelerindeki ihale"
000776;GMY TICARI ARAÇLAR;GMY TICARI ARAÇLAR;Sirketin ticari araç satis ve pazarlama politikasinin olusumuna katkida bulunulmasi ve satis hedeflerinin realize edilmesinin saglanmasi.;Ilgili prosedür ve talimatlar ihale mevzuati özel sartnameler ve karayollari / trafik kanunlari çerçevesinde çalisir.;"lerinin takibinin saglanmasi., Uygun olan ihalelere/alimlara katilimin saglanmasi., Teslimatlarinin ilgili sözlesme hükümlerine göre ve zamaninda yapilmasinin saglanmasi., Alacaklarinin takibinin ve araç bedellerinin zamaninda alinmasinin saglanmasi., Verilmis teminat mektuplarinin takibi ve islevi bitenlerin zamaninda geri alinmasinin saglanmasi, Araç tanitimi için farkli etkinliklerin (fuar katilimi seminer katilimi vb.) gerçeklestirilmesinin saglanmasi, Süreç çiktilarimiz olarak sirket ürünleri ile ilgili veri bankasinin olusturulmasinin ve bunlarin dokumante edilmesinin saglanmasi., Çevik çalisma metodolojisinin gerekliliklerinin (daily, sprint planlama, review vb.) yerine getirilmesini saglamak., "
