SicilNo;Birim;Mudurluk;Amac;Yetki;AnaSorumluluks
009047;MIDIBÜS ÜRÜN UYARLAMA LIDERLIGI;TIC. ARAÇLAR SISTEM MÜH. VE PLATFORM DIR;"Müsteri isterleri göz önüne alinarak mevcut araç türevlerininyeni araç konsept çalismalarinin olusturulmasi ve ürün gelistirme projelerinde tasarim güvence-homologasyon / Teknik Belgelendirme sürecinin asamalari boyunca araçlarin yasal mevzuata uygunlugunun gözetilerek tasarima veri olusturulmasinin saglanmasi için gerekli teknik / mühendislik çalismalarinin yürütülmesi. Araçlarin teknik speklerinin güncelliginin korunmasinin saglanmasi çalismalarinin yürütülmesi. ";"ÜMP05201 Yayin sistemi ve takibi prosedürü TEP04201 Tasarim prosedürü TET04201 Ürün siniflandirma talimati TET04202 Prototip hazirlama ve yönetim talimati TET04203 Tasarim planlama talimati TET10201 Prototip test talimati TSE Standartlari RES-BLS BMW Standartlari ve DIN Standartlari çerçevesinde çalisir. ";" Yeni ve türev araç teknik özelliklerinin ve konfigürasyonunun belirlenmesini saglar teknik özellik dokümanlarini hazirlar., Midibüs Platformlari Sistem Mühendisligi Müdürlügü’nün türev/ihale/sartnamelerde ihtiyaç duydugu teknik bilgileri saglar., Ticari Araçlar mühendislik direktörlügü tarafindan gerçeklestirilen türev ve yeni araç projelerinde gereksinim analizlerini ve tanimli genel gereksinimlerin kalifikasyonunu takip eder., Yeni araç projelerinde Sistem ve Ana komponentlerinin araç entegrasyonunu paketleme isleri komponent yer belirleme (zarf) tanimlamalarini yapar., Yeni araç projelerinde konsept tasarim çalismalarini yapar. Agirlik dagilim ve komponent kapasite ve performans ön hesaplamalarini yaparak ana sistem ve komponent seçimlerine öncülük eder, Yeni araç projelerinde girdi olarak kullanilmak üzere Satis/Pazarlama birimleri ile koordineli olarak saha müsteri gereksinimleri ve rakip analizlerini gerçeklestirir ve pazar arastirmasi yapar., Satis pazarlama müsteri bayi vb teknik bilgi destegi verir., Satis/Pazarlama birimlerinden veya Iç müsteriden gelen yeni araç taleplerinin teknik ön degerlendirmesini yapar. UYGUN veya RED kararinin alinmasina öncülük eder. Uygunluk alan projeler için ilgili bölümler ile koordinasyonu saglar., Ilgili konfigürasyon birimleri ile koordineli olarak araç kodu belirler PDM’de gerekli CAD ana product ve klasörlerinin olusturulmasini takip eder., Türev ve Yeni araç projelerinde degisiklik ve yeni çalisma/is listelerini Ticari Araçlar mühendislik direktörlügüne devreder. Ticari Araçlar mühendislik direktörlügü tarafindan yapilan yayinlarin içerik kontrollerini CAD model gözden geçirmelerini yapar., Homologasyon faaliyetleri için gerekli dokümanlarin ilgili birimlerden teminini saglar ve araç proje resimlerini hazirlar., Yeni ve Türev araç projelerinde ihtiyaç duyulan test ve validasyon süreçlerini tanimlar. Uygulattirir ve takip eder. Araç test ve dogrulama faaliyetlerini takip eder. Test çiktilarini ilgili departmanlar ile degerlendirir, Ilgili bölümlerce hazirlanan brösür katalog ve kullanici el kitaplari ile ilgili ihtiyaç duyulan teknik bilgileri saglar., Prototip araçlarin sahipligini üstlenir üretim asamalarinin yönetim ve koordinasyonunu yapar, Mühendislik veri yönetimi grubu ile koordineli olarak PDM Opsiyon ve Varyant yönetimini üstlenir., Yeni ve türev araç süreçlerinde homologasyon ihtiyaç gereksinimlerini belirler ilgili departmanlarin koordinasyonunu saglar.,  Yeni ve türev araç teknik özelliklerinin ve konfigürasyonunun belirlenmesini saglar teknik özellik dokümanlarini hazirlar., Midibüs Platformlari Sistem Mühendisligi Müdürlügü’nün türev/ihale/sartnamelerde ihtiyaç duydugu teknik bilgileri saglar., Ticari Araçlar mühendislik direktörlügü tarafindan gerçeklestirilen türev ve yeni araç projelerinde gereksinim analizlerini ve tanimli genel gereksinimlerin kalifikasyonunu takip eder., Yeni araç projelerinde Sistem ve Ana komponentlerinin araç entegrasyonunu paketleme isleri komponent yer belirleme (zarf) tanimlamalarini yapar., Yeni araç projelerinde konsept tasarim çalismalarini yapar. Agirlik dagilim ve komponent kapasite ve performans ön hesaplamalarini yaparak ana sistem ve komponent seçimlerine öncülük eder, Yeni araç projelerinde girdi olarak kullanilmak üzere Satis/Pazarlama birimleri ile koordineli olarak saha müsteri gereksinimleri ve rakip analizlerini gerçeklestirir ve pazar arastirmasi yapar., Satis pazarlama müsteri bayi vb teknik bilgi destegi verir., Satis/Pazarlama birimlerinden veya Iç müsteriden gelen yeni araç taleplerinin teknik ön degerlendirmesini yapar. UYGUN veya RED kararinin alinmasina öncülük eder. Uygunluk alan projeler için ilgili bölümler ile koordinasyonu saglar., Ilgili konfigürasyon birimleri ile koordineli olarak araç kodu belirler PDM’de gerekli CAD ana product ve klasörlerinin olusturulmasini takip eder., Türev ve Yeni araç projelerinde degisiklik ve yeni çalisma/is listelerini Ticari Araçlar mühendislik direktörlügüne devreder. Ticari Araçlar mühendislik direktörlügü tarafindan yapilan yayinlarin içerik kontrollerini CAD model gözden geçirmelerini yapar., Homologasyon faaliyetleri için gerekli dokümanlarin ilgili birimlerden teminini saglar ve araç proje resimlerini hazirlar., Yeni ve Türev araç projelerinde ihtiyaç duyulan test ve validasyon süreçlerini tanimlar. Uygulattirir ve takip eder. Araç test ve dogrulama faaliyetlerini takip eder. Test çiktilarini ilgili departmanlar ile degerlendirir, Ilgili bölümlerce hazirlanan brösür katalog ve kullanici el kitaplari ile ilgili ihtiyaç duyulan teknik bilgileri saglar., Prototip araçlarin sahipligini üstlenir üretim asamalarinin yönetim ve koordinasyonunu yapar, Mühendislik veri yönetimi grubu ile koordineli olarak PDM Opsiyon ve Varyant yönetimini üstlenir., Yeni ve türev araç süreçlerinde homologasyon ihtiyaç gereksinimlerini belirler ilgili departmanlarin koordinasyonunu saglar., Çevik çalisma metodolojisinin gerekliliklerinin (daily, sprint planlama, review vb.) yerine getirilmesini saglamak., "
009175;TIC. ARAÇLAR SISTEM MÜH. VE PLATFORM DIR;TIC. ARAÇLAR SISTEM MÜH. VE PLATFORM DIR;"Ticari araçlarda estetik fonksiyon ve ergonomi kriterlerine uygun olarak endüstriyel tasarim faaliyetlerini yürütmek ";"TEP04201 Tasarim prosedürü TET04201 Ürün siniflandirma talimati TET04202 Prototip hazirlama ve yönetimi talimati TET04203 Tasarim planlama talimati ";" icari araç ailelerindeki araçlarin iç ve dis görsel parçalarinin family look konsepti içinde proje kriterlerine uygun olarak estetik ve ergonomi kurallarini dikkate alarak ayni zamanda modüler tasarim anlayisi çerçevesi içinde endüstriyel tasarimini yapmak, raçlarin stil ve konsept belirleme çalismalarini yürütmek bununla ilgili öncesinde veya sirasinda benchmark çalismalari pazar ve trend arastirmalari yapmak, asarim çalismalarinda iletilen müsteri talepleri pazar beklentileri genel veya lokal regülasyon sartlarini dikkate almak rafta hazir ürün seçimi söz konusu oldugu durumlarda ilgili birimlerle birlikte komponent seçimi bu ürünün montaj servis edilebilirlik regülasyon sartlarini dikkate alarak gerçeklestirmek bu parçalarin araç kimligi ve diger komponentlerle uyumunu saglamak, asarimini yaptigi parçalarin 3D yüzey datalarini çikarir A yüzeylerin (disaridan görünen yüzeyler) kenar büküm ve radyüslerini yaparak mühendislik çalismalarini yapmak üzere ilgili bölümlere göndermek, ç ve dis parçalarin tasarim faaliyetlerini maliyet üretilebilirlik hafiflik montaj servis edilebilirlik ve malzeme uygunlugu konusunda iletilen isterleri de dikkate alarak yapmak süreç dahilinde ilgili bölümlerle birlikte çalismalarini yürütmek geri bildirimlere göre revizyonlari yapmak tasarimlarini maksimum ortak parça kullanimini göz önünde bulundurarak sekillendirmek, eni ve türev araçlarin iç ve dis renklerinin uyum çalismasini doku boya renk kumas ve desen seçimlerini yapmak araç boya maskelemelerinin tarifini hazirlamak, raçlarin iç ve dis renklerini uyumlu bir sekilde belirlemek için fotorealistik görüntülerini alarak görsel sunumlar hazirlamak render ve animasyon çalismalarini yapmak iç ve dis etiketler folyo dis giydirme yazi ve desenlerin grafik çalismalarini yapmak, tyling çalismalari yapilip onayi alinan araç dis görseli soför mahali tavan yapisi vb parçalarin mock-up hazirliklarini yapmak prototip araçlar üzerinde dogrulamasini gerçeklestirmek soför bölgesi tasarim çalismalarini genel ergonomi gerekleri iletilen genel veya lokal regülasyon sartlari ve VDV gibi özel talepleri dikkate alarak gerçeklestirmek, eni ve türev araçlar ile ihale araçlarinin ölçekli maketlerini yapmak / yaptirmak, eni tanimlanmasi gereken etiket ve ekran gibi bilgilendirici içeriklerin grafik çalismasini yapmak araç üzerinde prototip dogrulama faaliyetlerini gerçeklestirmek, zel araç projelerinde araç iç ve dis tasarimini malzeme ve komponent seçimini üst yapici firma ile birlikte çalismak, ndüstriyel tasarim tescil basvurusu için gerekli dokümanlari hazirlamak ve sürece destek vermek, Ticari araç ailelerindeki araçlarin iç ve dis görsel parçalarinin family look konsepti içinde proje kriterlerine uygun olarak estetik ve ergonomi kurallarini dikkate alarak ayni zamanda modüler tasarim anlayisi çerçevesi içinde endüstriyel tasarimini yapmak, Araçlarin stil ve konsept belirleme çalismalarini yürütmek bununla ilgili öncesinde veya sirasinda benchmark çalismalari pazar ve trend arastirmalari yapmak, Tasarim çalismalarinda iletilen müsteri talepleri pazar beklentileri genel veya lokal regülasyon sartlarini dikkate almak rafta hazir ürün seçimi söz konusu oldugu durumlarda ilgili birimlerle birlikte komponent seçimi bu ürünün montaj servis edilebilirlik regülasyon sartlarini dikkate alarak gerçeklestirmek bu parçalarin araç kimligi ve diger komponentlerle uyumunu saglamak, Tasarimini yaptigi parçalarin 3D yüzey datalarini çikarir A yüzeylerin (disaridan görünen yüzeyler) kenar büküm ve radyüslerini yaparak mühendislik çalismalarini yapmak üzere ilgili bölümlere göndermek, Iç ve dis parçalarin tasarim faaliyetlerini maliyet üretilebilirlik hafiflik montaj servis edilebilirlik ve malzeme uygunlugu konusunda iletilen isterleri de dikkate alarak yapmak süreç dahilinde ilgili bölümlerle birlikte çalismalarini yürütmek geri bildirimlere göre revizyonlari yapmak tasarimlarini maksimum ortak parça kullanimini göz önünde bulundurarak sekillendirmek, Styling çalismalari yapilip onayi alinan araç dis görseli soför mahali tavan yapisi vb parçalarin mock-up hazirliklarini yapmak prototip araçlar üzerinde dogrulamasini gerçeklestirmek soför bölgesi tasarim çalismalarini genel ergonomi gerekleri iletilen genel veya lokal regülasyon sartlari ve VDV gibi özel talepleri dikkate alarak gerçeklestirmek, Yeni ve türev araçlar ile ihale araçlarinin ölçekli maketlerini yapmak / yaptirmak, Özel araç projelerinde araç iç ve dis tasarimini malzeme ve komponent seçimini üst yapici firma ile birlikte çalismak, Endüstriyel tasarim tescil basvurusu için gerekli dokümanlari hazirlamak ve sürece destek vermek,  • Yeni ve türev araçlarin iç ve dis renklerinin uyum çalismasini doku boya renk kumas ve desen seçimlerini yapmak araç boya maskelemelerinin tarifini hazirlamak, • Araçlarin iç ve dis renklerini uyumlu bir sekilde belirlemek için fotorealistik görüntülerini alarak görsel sunumlar hazirlamak render ve animasyon çalismalarini yapmak iç ve dis etiketler folyo dis giydirme yazi ve desenlerin grafik çalismalarini yapmak, • Yeni tanimlanmasi gereken etiket ve ekran gibi bilgilendirici içeriklerin grafik çalismasini yapmak araç üzerinde prototip dogrulama faaliyetlerini gerçeklestirmek, Çevik çalisma metodolojisinin gerekliliklerinin (daily, sprint planlama, review vb.) yerine getirilmesini saglamak., "
009309;TICARI ARAÇLAR GÖVDE ÜRETIM MÜDÜRLÜGÜ;TICARI ARAÇLAR GÖVDE ÜRETIM MÜDÜRLÜGÜ;Yayinlanan günlük haftalik ve aylik üretim programina uygun olarak üretimin gerçeklesmesinin saglanmasi ve raporlanmasi.;Grup  Yöneticisinin talimat ve onayi çerçevesinde çalisir.;" Günlük üretim programinin hedeflenen zaman verimlilik ve kalitede gerçeklesmesi için ekiplerin kordinasyonunu saglamak., Günlük hat  durum takip listelerinin hazirlanmasi raporlanmasi ve takibinin yapilmasini saglamak., Ürün mühendisliginin yayin bildirimleri ve operasyon sayfalarina uygun olarak araçlarin üretilmesini saglamak üretim sirasinda ortaya çikan sorunlari gerekli birimlere bildirmek ve takibini yapmak., Birim ünite bazinda brüt ve net verimliligi tutturmak ve iyilestirmek., Sorumluluk alanindaki çalismalarin is güvenligi kurallarina uygun yapilmasini saglamak tespit edilen uygunsuzluklari kapatmak ve risk degerlendirmelerinin güncelligini saglamak için ISG Birimi ile birlikte çalismak, Sorumluluk alaninda meydana gelen is kazalarinin analiz edilip kazalarin tekrarlanmasi ve gerekli önlemlerin alinmasi için Üretim ve Tesis Mühendislik ISG Birimi ve ilgili birimler ile birlikte çalismak., Çalisanlarin günlük puantajlarini ve çalistiklari isleri düzenli takip etmek ve raporlamak., Sorumluluk alanindaki tüm tezgah ve ekipmanlarin isler halde ve bakimli olmasini saglamak, Çevre yönetiminde sorumluluk alanindaki çalismalarin Kalite Çevre Enerji Bilgi Güvenligi Is Sagligi ve Güvenligi ile ilgili talimat ve kurallara uygun yapilmasini ilgili birimler ile koordineli olarak gerekli risk önleyici tedbirlerin alinmasini ve gelisimini yönetmek. Sorumluluk alaninda liderlik ederek etkin bir Çevre Yönetim Sistemi ve sistemin sartlarina uyum için destek vermek sorumluluk alaninda risk ve firsatlarin degerlendirilmesini saglamak çevresel amaç ve hedeflerin uyumu için gerekli çalismalara destek olmak, Çevik çalisma metodolojisinin gerekliliklerinin (daily, sprint planlama, review vb.) yerine getirilmesini saglamak., "
009311;TIC. ARAÇLAR SISTEM MÜH. VE PLATFORM DIR;TIC. ARAÇLAR SISTEM MÜH. VE PLATFORM DIR;Ihalelerde gelistirilen araçlarin isterlerini  pazar gereksinimleri de baz alarak isterleri bastan proje sonuna kadar planli bir sekilde yönetmek.;Yöneticisinin yönlendirmesi ile çalisir;" Ticari araçlar sehiriçi otobüs platformlari sistem mühendisligi bünyesinde türev araç projeleri kapsaminda asagida belirtilen sorumluluklarini yerine getirmek,  Ürün Yasam Döngüsü Yönetimi (PLM) Süreçlerinin tasarlanmasi, PDM Dijital Araç Modelleme Yönetimi, PDM / CAD Raporlama araçlarinin yönetimi, PLM/PDM Windchill Program kullanim alanlarinin genisletilmesi, PDM ECN sürecinin yönetilmesi / Yayinlarin takibi ve onaylanmasi,  Ticari araçlar sehiriçi otobüs platformlari sistem mühendisligi bünyesinde türev araç projeleri kapsaminda asagida belirtilen sorumluluklarini yerine getirmek, Araç sistem gereksinimlerinin belirlenme sürecine katilmak ürün konseptinin olusturulmasina ve ürün taniminin yapilmasina katki sunmak, Araç tasarim sürecinde kavramsal tasarim asamasindan baslayarak nihai ürün ortaya çikana kadarki süreçten katki saglamak Ar-Ge tasarim birimleri ile birlikte es zamanli olarak çalismak, Komponent üreticisi firmalarla yapilan teknik görüsmelere katilmak, Sistem entegrasyon süreçlerini takip ve koordine etmek araç is paketi sorumlulugu is süreçlerinin takibini yapmak, Projelerde belirlenen teknik risk analizlerinde önleyici faaliyet çalismalarinda yer almak, Prototip araçlarin Ar-Ge tasarim atelyelerinde üretim süreçlerinin koordinasyonunu saglamak prototip araçlarla ilgili belirlenmis test validasyon yöntemlerinin icra edilmesi sonuçlarinin degerlendirilmesi yapmak iyilestirme konularinin araçlar üzerinde uygulanmasini saglamak, Araçlarin homologasyon testlerinin gerçeklestirilmesini saglamak ve homologasyon sürecinde ilgili departmanlakoordinasyon içinde çalismak, Yeni araç projelerinde baz ve versiyon modellerin agirlik hesaplamalarini yapmak, Ürün ve projelerin CAD productlarini olusturmak tasarim gözden geçirme faaliyetlerini yapmak tasarim faaliyetleri esnasinda olusan sorun ve sikintilarin çözümü için gerekli aksiyonlarin alinmasini saglamak, Bölüm içi fabrika içi Ar-Ge is süreçlerinin takibini yapmak birimler arasi (tasarim satinalma üretim üretimtesis planlama kalite analiz test satis sonrasi ..vb) koordinasyonu saglamak, Araçlarin seri üretim devreye alma sürecini takip etmek ve Ar-Ge faaliyetlerini bölüm içinde koordine etmek, Mevcut ürünlerin gelistirme test ve validasyon süreçlerini türevlerin olusturulmasi devreye alinmasi prosesine katilmak araçlarin yasam döngüsü boyunca takibini yapmak teknik özelliklerinin ve ilgili süreçlerin tam ve dogru oldugunu kontrol etmek, Ar-Ge Direktörlügü gelistirme projelerinde ölçüm ve analiz süreçlerinde çalismak iyilestirme konulari ile ilgili düzeltici/önleyici faaliyetlerin ilgili bölümlerle koordinasyonunu saglayarak araçlara uygulanmasini gerçeklestirmek, Ar-Ge Direktörlügü gelistirme projelerinde tasarim gözden geçirme ve dogrulama teknik veri paketinin hazirlanmasi teknik toplantilar raporlar kabuller ürün teslimatlari vb. faaliyetleri icra etmek ve koordine etmek, Araçlarla ilgili satis sonrasinda çikan problemlerin takibini koordinasyonunu yapmak Ar-Ge içinde önleyici tedbirlerin alinmasini saglamak SSH araciligi ile sahada icra edilecek düzeltici faaliyetlerinin yapilmasini saglamak ve faaliyetlere katilmak, Malzeme listelerinin kontrolünü yapmak eksik hatali noktalarda ilgili birimlerin faaliyet yürütmesini saglamak, Araç manuellerinin kontrolünü yapmak, Çevik çalisma metodolojisinin gerekliliklerinin (daily, sprint planlama, review vb.) yerine getirilmesini saglamak., "
009312;TIC ARÇ GÖVDE YAP MEKANIK SIST LIDERLIGI;TIC. ARAÇLAR MÜH. GRUP DIREKTÖRLÜGÜ;Tasarim Prosedürlerine Uygun Olarak Araç Yayinlarinin Hazirlanmasi Yeni Ürün Gelistirme Mevcut Ürün Iyilestirme Projelerinde Arastirma Ve Teknik Resim Çalismalarinin Yapilmasi.;Yönetici Yönlendirmesi Dogrultusunda Çalisir;" 1. Yeni ürün gelistirme yada iyilestirme projeleri ile ortaya çikan üretilebilir araç speklerini yayinlamak ve gerekli etüd ve resim çalismalarini yapmak, 2. Yeni ürün gelistirme ya da mevcut ürün iyilestirme projelerinde teknik resimleri ve malzeme speklerini çikarmak ve BOM sayfalarini hazirlamak, 3. Müsteri isteklerini karsilayacak yeni ürün gelistirme yada iyilestirme projeleri için teklif çalismalarini gerçeklestirmek, 4. Yeni ürün gelistirme projelerinde prototip ürünlerin üretim asamalarinda bulunarak kontrollerini yapmak. Uyumsuzluklari gidermek ve resimleri revize etmek., 5. Kendi alanindaki ürünlerle ilgili olarak teknolojik gelismeleri izlemek rakip ürünlerin arastirma çalismalarini yapmak., 6. Yeni ürün gelistirme yada iyilestirme projeleri ile ortaya çikan ürünlerle ilgili üretebilirlik esaslarini incelemek uyumsuzluklarin düzeltmek ve gerekli revizyonlari yapmak, 7. Mevcut ürünler üzerinde kalite iyilestirme maliyet düsürme ve performans gelistirme çalismalari yapmak., Çevik çalisma metodolojisinin gerekliliklerinin (daily, sprint planlama, review vb.) yerine getirilmesini saglamak., "
009532;SEHIR IÇI OTOBÜS YENI ÜRÜN PROJELERI LID;TIC. ARAÇLAR SISTEM MÜH. VE PLATFORM DIR;Yeni projelerde gelistirilen araçlarin isterlerini  pazar gereksinimleri de baz alarak isterleri bastan proje sonuna kadar planli bir sekilde yönetmek.;Yöneticisinin yönlendirmesi ile çalisir;"  Sistem Mühendisligi Müdürlügü yeni projeler kapsaminda yeni araçlarin layoutlarini çizmek ve agirlik hesaplarini yapmak., Sistem Mühendisligi Müdürlügü yeni projeler kapsaminda araç isterlerini belirleyip sisteme uygun sartnamesini tüm demo ve baz araçlar için olusturmak., Yeni projeler kapsaminda ki araçlarin isterlerini pazar ihtiyaci da baz alinarak talep edilen ortak özellikleri tüm araçlar ile kiyaslamak ve en gelismis ve son güncel isterlerin kullanilmasi için ekipleri yönlendirmek. Isterlerin risk analizlerini yine ekiplerle degerlendirerek projeyi aksatmamak adina ek bir çözüm stratejisini çikabilecek herhangi bir sorunda hizlica devreye alinmasini saglamak için belirlemis olmak., Yeni projeler kapsaminda ki araçlarin tüm sistemleri için talep edilen özellikleri uygulamasini araç görsellerini material detayina kadar tüm datalarinin oldugu dökümantasyon hazirligi yapmak. Araçlar için database olusturmak., Yeni APL yapisina geçisle birlikte degisen süreçlerin yönetilmesine katki saglamak yeni araçlarda bu sistemin uygulanmasi için araç bazli spek. hazirliklarini yapmak sistemi en kullanisli hale getirecek fikir ve önerilerde bulunmak.,  • Araçlarin mühendislik hesaplarini yapmak prototip çalismalarina katki saglamak test süreçlerini takip etmek ve raporlamak., • Mevcut araçlarin iyilestirme çalismalarinda tasarim ve mühendislik hesaplarini gerçeklestirmek prototip ve test süreçlerinde görev almak., • Yeni ürün gelistirme veya iyilestirme projelerinde ortaya çikan ürünlerle ilgili sapma taleplerini incelemek gerekli düzeltici/önleyici faaliyetlerin uygulanmasina destek olmak., • Yeni araçlarin alt sistemleri ve parçalarinin uluslararasi standartlara uygunlugunu arastirmak ön inceleme ve teknik raporlama yapmak., • Prototip araç parçalarinin test kosullarini belirlemeye katki saglamak arizalanan parçalarin iyilestirilmesi sürecini desteklemek test sonuçlarini degerlendirerek raporlamak., • Parçalarin yayinlanma sürecinde imalatçi ve kalite birimi tarafindan yapilan testlerin sonuçlarini kontrol etmek malzeme ve kaplama bilgilerini dogrulamak ön seriye gelen parçalarin uygunluk degerlendirmelerine katkida bulunmak., • Ar-Ge kapsaminda yeni ürün projeleri ile ilgili fuar internet veya saha incelemeleri yapmak ve raporlamak., • Seri üretimi devam eden araç veya parçalarda yerlilestirme ve maliyet düsürme çalismalarina destek olmak., Çevik çalisma metodolojisinin gerekliliklerinin (daily, sprint planlama, review vb.) yerine getirilmesini saglamak., "
009541;TIC ARÇ GÖVDE YAPISAL TASARIM LIDERLIGI;TIC. ARAÇLAR MÜH. GRUP DIREKTÖRLÜGÜ;Tasarim prosedürlerine uygun olarak araç yayinlarinin hazirlanmasi yeni ürün gelistirme mevcut ürün iyilestirme projelerinde arastirma ve  teknik resim çalismalarinin yapilmasi.;Yönetici yönlendirmesi dogrultusunda çalisir;" 1. Yeni ürün gelistirme yada iyilestirme projeleri ile ortaya çikan üretilebilir araç speklerini yayinlamak ve gerekli etüd ve resim çalismalarini yapmak, 2. Yeni ürün gelistirme ya da mevcut ürün iyilestirme projelerinde teknik resimleri ve malzeme speklerini çikarmak ve BOM sayfalarini hazirlamak., 3. Müsteri isteklerini karsilayacak yeni ürün gelistirme yada iyilestirme projeleri için teklif çalismalarini gerçeklestirmek, 4. Yeni ürün gelistirme projelerinde prototip ürünlerin üretim asamalarinda bulunarak kontrollerini yapmak. Uyumsuzluklari gidermek ve resimleri revize etmek., 5. Kendi alanindaki ürünlerle ilgili olarak teknolojik gelismeleri izlemek rakip ürünlerin arastirma çalismalarini yapmak., 6. Yeni ürün gelistirme yada iyilestirme projeleri ile ortaya çikan ürünlerle ilgili üretebilirlik esaslarini incelemek uyumsuzluklarin düzeltmek ve gerekli revizyonlari yapmak, 7. Mevcut ürünler üzerinde kalite iyilestirme maliyet düsürme ve performans gelistirme çalismalari yapmak., Çevik çalisma metodolojisinin gerekliliklerinin (daily, sprint planlama, review vb.) yerine getirilmesini saglamak., "
