SicilNo;Birim;Mudurluk;Amac;Yetki;AnaSorumluluks
006349;TIC. ARAÇLAR SISTEM MÜH. VE PLATFORM DIR;TIC. ARAÇLAR SISTEM MÜH. VE PLATFORM DIR;"Sorumlu oldugu araç gruplarinda müsteri/bayi taleplerinin araçlara uyarlanmasi araçlar için opsiyonlarin belirlenmesi ve tarifleri ihalelerde teknik sartnamenin incelenmesi ve sartnameye uygun hale getirilmesi karsilanamayan taleplere alternatif çözümler bulunulmasi homologasyon döküman ve bilgi destegi araçlarin mevzuatsal olarak güncelliginin saglanmasi baslica görevler arasinda yer almaktadir. ";"Türev araç siparislerinde taleplerin karsilanmasi için araç/opsiyon kodu belirlenmesi ve tarifleri APL ve model kontrolleri ile üretim uygunlugunun saglanmasi Ihale dokümanlarinda teknik sartnamenin incelenmesi araç belirlenmesi ve maliyet çalismalari için parça listesinin olusturulmasi ve doküman destegi. Araçlarin güncel mevzuatlara uygunlugunun saglanmasi. SSH sorunlarinin çözümlerinde destekler. Araç proje resimleri ve agirlik hesaplarinin hazirlanmasi. ";" 1. Yeni ürün gelistirme yada iyilestirme projelerinde araç Tiplerine ait tasarim güvence-homologasyon  programlarini  ilgili birimlerle koordineli olarak  yürütmek., 2. Yeni ürün gelistirme yada iyilestirme projelerinde araç Tiplerine ait Sistem Tip Onay belgelendirme islemleri için  yurtiçi ve yurtdisi resmi “Teknik Servis Kuruluslari” ile test-muayene islemleri için gerekli hazirliklari yapmak bu islemleri yürü, 3. Araç Tiplerine ait Komple Araç Tip Onay belgelendirme islemleri için  yurtiçi ve yurtdisi resmi “Onay Kuruluslari” nezdindeki her türlü teknik ve idari islemlemlerini yürütmek ve neticelendirmek., 4. Iyilestirme projelerinde her Araç Tipine ait mevcut Tip Onay belgeleri için  gerekli güncellenme ihtiyaçlarini belirlemek bunlari ilgili resmi kuruluslar ile koordine ederek Tip Onay belgelerinin güncellenmesini saglamak., 5. Yeni ürün gelistirme yada iyilestirme projelerinde her bir araç tipi ve türevlerinin mevcut sistem TO ve komple araç TO sertifikasyonu ile uyumlu olarak tasarlanabilmesi/üretilebilmesi için Gerekli CoP (Conformity of ProductionÜretimin Uygunlugu), 6. Motorlu Araç Tasarim/Üretim sürecinin tüm asamalari ve boyutlariyla ilgili yasal mevzuatin takibi yeni mevzuatin olusturulmasi bunlarin uygulamasi sürecinde  firma disi kurum ve kuruluslarla yapilan ortak çalismalara katilim ve katkida bulunmak.., 7. Görev tanimina giren konularla ilgili olarak  Takim Liderinin yönlendirmesi ile  firma içi ve disi muhtelif taraflarin ihtiyaç duyacagi destekleyici bilgilerin teminen gerekli çalismalari yapmak.,  1. Yeni ürün gelistirme yada iyilestirme projelerinde araç Tiplerine ait tasarim güvence-homologasyon  programlarini  ilgili birimlerle koordineli olarak  yürütmek., 2. Yeni ürün gelistirme yada iyilestirme projelerinde araç Tiplerine ait Sistem Tip Onay belgelendirme islemleri için  yurtiçi ve yurtdisi resmi “Teknik Servis Kuruluslari” ile test-muayene islemleri için gerekli hazirliklari yapmak bu islemleri yürü, 3. Araç Tiplerine ait Komple Araç Tip Onay belgelendirme islemleri için  yurtiçi ve yurtdisi resmi “Onay Kuruluslari” nezdindeki her türlü teknik ve idari islemlemlerini yürütmek ve neticelendirmek., 4. Iyilestirme projelerinde her Araç Tipine ait mevcut Tip Onay belgeleri için  gerekli güncellenme ihtiyaçlarini belirlemek bunlari ilgili resmi kuruluslar ile koordine ederek Tip Onay belgelerinin güncellenmesini saglamak., 5. Yeni ürün gelistirme yada iyilestirme projelerinde her bir araç tipi ve türevlerinin mevcut sistem TO ve komple araç TO sertifikasyonu ile uyumlu olarak tasarlanabilmesi/üretilebilmesi için Gerekli CoP (Conformity of ProductionÜretimin Uygunlugu), 6. Motorlu Araç Tasarim/Üretim sürecinin tüm asamalari ve boyutlariyla ilgili yasal mevzuatin takibi yeni mevzuatin olusturulmasi bunlarin uygulamasi sürecinde  firma disi kurum ve kuruluslarla yapilan ortak çalismalara katilim ve katkida bulunmak.., 7. Görev tanimina giren konularla ilgili olarak  Takim Liderinin yönlendirmesi ile  firma içi ve disi muhtelif taraflarin ihtiyaç duyacagi destekleyici bilgilerin teminen gerekli çalismalari yapmak., Araç teknik özelliklerinin konfigürasyonunun belirlenmesini saglar spekleri hazirlar, ürev araçlarda sistem ve komponentlerin araç ön paketleme ve yerlesim islerini zarf tanimlamalarini yapar, raç ve opsiyon isim ve kodlarinin belirlenmesini dökümantasyon birimiyle koordineli olarak çalisma klasörlerinin olusturulmasini IT birimiyle koordineli olarak saglar, roje yönetiminden gelen ihale dökümanlari teknik sartname incelemelerinin gereksinim yönetimini yapar, üsteri ihtiyaçlari ve araç gereksinimlerini  ilgili satis departmanlarinin ve TA Proje ve Kaynak Yönetimi Müdürlügü’nden iletilen bilgiler ile belirler ve süreci yönetir., atis/Pazarlama birimlerinden iç müsteriden veya TA Proje ve Kaynak Yönetimi Müdürlügün’den gelen yeni araç taleplerinin teknik ön degerlendirmesini yapar. Ihtiyaç duydugu teknik konularda mühendislik ekiplerinden görüs alip teknik olarak  UYGUN veya RET karari verir. Uygunluk alan projeler için ilgili bölümler ile koordinasyonu saglar., A Proje ve Kaynak Yönetimi Müdürlügü’nden gelen türev araç taleplerinin teknik ön degerlendirmesini yapar, ürev araç projelerinde Proje yönetimi araciligi ile gelen Satis pazarlama müsteri bayi vb teknik destek ihtiyaçlarini karsilar, atis pazarlama birimlerinin hazirladigi brosürleri inceler ve onaylar, eni ve türev araç süreçlerinde homologasyon ihtiyaç gereksinimlerini homologasyon birimiyle birlikte belirler  sürecin takibini ve koordinasyonunu saglar, omologasyon ihale ve seri üretim araçlarinin ilgili sistemlerine ait prototip araç üzerindeki testlerini yapar veya yapilmasini saglar. Prototip araç bulunmamasi durumunda seri üretim araç temin edip testleri icrasini saglar., omologasyon faaliyetleri için gerekli döküman hazirliklarini yapar teminini saglar. Araç proje resimlerini hazirlar homologasyon biriminin ihtiyaç duydugu diger izolasyon profil kesit resimleri motor sanziman akslar susturucu yakit deposu klima ve kalorifer yerlesimi ve benzeri komponentlere ait tüm detay resimleri ilgili mühendislik bölümlerinden tedarik eder, roje yönetiminden gelen taleplere göre ihaleler için gerekli teknik analizleri yapar sorulara cevap verir gerekli resim ve belgeleri olusturur veya teminini saglar., üsteri (fabrika içi veya disi) ve kullanicilardan gelen direkt veya endirekt taleplerin araçlara uygulanabilirligini degerlendirir uygun olanlar için aksiyon alinmasini saglar, ayin asamasinin süreç adimlarinda ilgili tasarim onay sürecinden  sonra PDM içinde kontrol ve onay rolü üstlenir, raçlarin agirlik hesaplamalarini yapar. Araç yasam döngüsü içinde agirlik kontrolünü CAD data üzerinden gerçeklestirir ve fiziki araçlarla mukayeseli yönetimini yapar, raç sistemlerinin CAD productlarinin tasarim gözden geçirme ve çakisma kontrolleri routing kontrollerini yapar. CAD productlarin teknik sartname regülasyon ve direktiflere göre kontrolünü gerçeklestirir uygunsuzluklar hakkinda tasarim ekiplerine bilgi verir. Tasarimi PDM ortaminda yapilmayan araçlarda cad product olusturur ve product yönetimini üstlenir. Ilgili TA mühendislik birimlerinin CAD tamamlama çalismalarini gözlemler ve eksiklikler için bilgi verir., • Araç teknik özelliklerinin konfigürasyonunun belirlenmesini saglar spekleri hazirlar, • Türev araçlarda sistem ve komponentlerin araç ön paketleme ve yerlesim islerini zarf tanimlamalarini yapar, • Araç ve opsiyon isim ve kodlarinin belirlenmesini dökümantasyon birimiyle koordineli olarak çalisma klasörlerinin olusturulmasi için koordineyi saglar, • Proje yönetiminden gelen ihale dökümanlari teknik sartname incelemelerinin gereksinim yönetimini yapar, • Müsteri ihtiyaçlari ve araç gereksinimlerini ilgili satis departmanlarinin ve TA Proje ve Kaynak Yönetimi Müdürlügü’nden iletilen bilgiler ile belirler, • Satis/Pazarlama birimlerinden iç müsteriden veya TA Proje ve Kaynak Yönetimi Müdürlügün’den gelen yeni araç taleplerinin teknik ön degerlendirmesini yapar. Ihtiyaç duydugu teknik konularda mühendislik ekiplerinden görüs alip teknik olarak UYGUN veya RET karari verir. Uygunluk alan projeler için ilgili bölümler ile koordinasyonu saglar., • TA Proje ve Kaynak Yönetimi Müdürlügü’nden gelen türev araç taleplerinin teknik ön degerlendirmesini yapar, • Türev araç projelerinde Proje yönetimi araciligi ile gelen Satis pazarlama müsteri bayi vb teknik destek ihtiyaçlarini karsilar, • Satis pazarlama birimlerinin hazirladigi ve benzeri teknik dokümanlari inceler ve talep"
006398;TIC. ARÇ. MÜHENDISLIK PROJE YÖNETIM MÜD.;TIC. ARÇ. MÜHENDISLIK PROJE YÖNETIM MÜD.;"üretim sürecinin satis talepleriyle uyumlu, zamaninda ve etkin sekilde yürütülmesini; müsteri memnuniyetinin artirilmasini ve sirketin stratejik üretim hedeflerine ulasmasini amaçlamaktadir.";Yöneticisinin yönlendirmesiyle çalisir;" *Satis ekibinden gelen siparislerin istenilen zamanda üretilebilirligini belirli kisitlara göre kontrol etmek., *Kontrol sonucu ana üretim ve detay üretim programlarini olusturmak., *Planlanan ve gerçeklesen üretim durumunu kontrol etmek., *Araçlarin istenilen zamanda teslimata hazir hale getirilmesi için ilgili departmanlar arasi bilgilendirmenin saglanmasi., *Ticari araç ihaleleri için tüm kisitlari göz önüne alarak teslimat plani olusturmak., *Tüm araç gruplari için ana üretim planinin takibi ve ilgili birimlerle paylasimini saglamak., *Ithal parça stok seviyesini azaltmak amaci ile ithal parça siparislerinin kontrolünü saglamak.,  *Satis ekibinden gelen siparislerin istenilen zamanda üretilebilirligini belirli kisitlara göre kontrol etmek., *Kontrol sonucu ana üretim ve detay üretim programlarini olusturmak., *Planlanan ve gerçeklesen üretim durumunu kontrol etmek., *Araçlarin istenilen zamanda teslimata hazir hale getirilmesi için ilgili departmanlar arasi bilgilendirmenin saglanmasi., Koto ve Kamyon OK plani hedefine ulasilabilmesi için gerekli koordinasyonu saglamak., Çevik çalisma metodolojisinin gerekliliklerinin (daily, sprint planlama, review vb.) yerine getirilmesini saglamak., "
006530;TIC. ARAÇLAR SISTEM MÜH. VE PLATFORM DIR;TIC. ARAÇLAR SISTEM MÜH. VE PLATFORM DIR;Ticari araçlarda estetik fonksiyon ve ergonomi kriterlerine uygun olarak endüstriyel tasarim faaliyetlerini yürütmek;TEP04201 Tasarim prosedürü TET04201 Ürün siniflandirma talimati TET04202 Prototip hazirlama ve yönetimi talimati TET04203 Tasarim planlama talimati;" . Araçlarin iç ve dis stil belirleme ve tasarim çalismalari ile ilgili ön analizlerini yapmak., . Otomotiv alt sistemleri ve malzemeleri ile ilgili yenilikleri takip etmek ., . Ergonomi kurallarina uygun olarak araçlarin iç ve dis görünümleri ile ilgili konsept gelistirmek uygun görülen konseptlerin üretilebilir modellerini olusturmak . Tasarim çalismalarini destekleyici prototipler hazirlamak . Prototip araçlarda bunla, . Araçlarin iç ve dis renklerini uyumlu bir sekilde belirlemek fotorealistik görüntülerini alarak görsel sunular hazirlamak folyo ve desen çalismalari yapmak., . Istirak edilen fuarlardaki sirket standlarinin tasarimini yapmak ve kurulmasina katkida bulunmak., . Yapilan tasarimlarin dogruluma testlerine göre gerekli iyilestirmeleri yapmak.,  . Araçlarin iç ve dis stil belirleme ve tasarim çalismalari ile ilgili ön analizlerini yapmak., . Otomotiv alt sistemleri ve malzemeleri ile ilgili yenilikleri takip etmek ., . Araçlarin iç ve dis renklerini uyumlu bir sekilde belirlemek fotorealistik görüntülerini alarak görsel sunular hazirlamak folyo ve desen çalismalari yapmak., . Istirak edilen fuarlardaki sirket standlarinin tasarimini yapmak ve kurulmasina katkida bulunmak., . Yapilan tasarimlarin dogruluma testlerine göre gerekli iyilestirmeleri yapmak.,  Ticari araç ailelerindeki araçlarin iç ve dis görsel parçalarinin family look konsepti içinde proje kriterlerine uygun olarak estetik ve ergonomi kurallarini dikkate alarak ayni zamanda modüler tasarim anlayisi çerçevesi içinde endüstriyel tasarimini yapmak, Araçlarin stil ve konsept belirleme çalismalarini yürütmek bununla ilgili öncesinde veya sirasinda benchmark çalismalari pazar ve trend arastirmalari yapmak, Tasarim çalismalarinda iletilen müsteri talepleri pazar beklentileri genel veya lokal regülasyon sartlarini dikkate almak rafta hazir ürün seçimi söz konusu oldugu durumlarda ilgili birimlerle birlikte komponent seçimi bu ürünün montaj servis edilebilirlik regülasyon sartlarini dikkate alarak gerçeklestirmek bu parçalarin araç kimligi ve diger komponentlerle uyumunu saglamak, Tasarimini yaptigi parçalarin 3D yüzey datalarini çikarir A yüzeylerin (disaridan görünen yüzeyler) kenar büküm ve radyüslerini yaparak mühendislik çalismalarini yapmak üzere ilgili bölümlere göndermek, Iç ve dis parçalarin tasarim faaliyetlerini maliyet üretilebilirlik hafiflik montaj servis edilebilirlik ve malzeme uygunlugu konusunda iletilen isterleri de dikkate alarak yapmak süreç dahilinde ilgili bölümlerle birlikte çalismalarini yürütmek geri bildirimlere göre revizyonlari yapmak tasarimlarini maksimum ortak parça kullanimini göz önünde bulundurarak sekillendirmek, Yeni ve türev araçlarin iç ve dis renklerinin uyum çalismasini doku boya renk kumas ve desen seçimlerini yapmak araç boya maskelemelerinin tarifini hazirlamak, Araçlarin iç ve dis renklerini uyumlu bir sekilde belirlemek için fotorealistik görüntülerini alarak görsel sunumlar hazirlamak render ve animasyon çalismalarini yapmak iç ve dis etiketler folyo dis giydirme yazi ve desenlerin grafik çalismalarini yapmak, Styling çalismalari yapilip onayi alinan araç dis görseli soför mahali tavan yapisi vb parçalarin mock-up hazirliklarini yapmak prototip araçlar üzerinde dogrulamasini gerçeklestirmek soför bölgesi tasarim çalismalarini genel ergonomi gerekleri iletilen genel veya lokal regülasyon sartlari ve VDV gibi özel talepleri dikkate alarak gerçeklestirmek, Yeni ve türev araçlar ile ihale araçlarinin ölçekli maketlerini yapmak / yaptirmak, Yeni tanimlanmasi gereken etiket ve ekran gibi bilgilendirici içeriklerin grafik çalismasini yapmak araç üzerinde prototip dogrulama faaliyetlerini gerçeklestirmek, Özel araç projelerinde araç iç ve dis tasarimini malzeme ve komponent seçimini üst yapici firma ile birlikte çalismak, Endüstriyel tasarim tescil basvurusu için gerekli dokümanlari hazirlamak ve sürece destek vermek,  Ticari araç ailelerindeki araçlarin iç ve dis görsel parçalarinin family look konsepti içinde proje kriterlerine uygun olarak estetik ve ergonomi kurallarini dikkate alarak ayni zamanda modüler tasarim anlayisi çerçevesi içinde endüstriyel tasarimini yapmak, Araçlarin stil ve konsept belirleme çalismalarini yürütmek bununla ilgili öncesinde veya sirasinda benchmark çalismalari pazar ve trend arastirmalari yapmak, Tasarim çalismalarinda iletilen müsteri talepleri pazar beklentileri genel veya lokal regülasyon sartlarini dikkate almak rafta hazir ürün seçimi söz konusu oldugu durumlarda ilgili birimlerle birlikte komponent seçimi bu ürünün montaj servis edilebilirlik regülasyon sartlarini dikkate alarak gerçeklestirmek bu parçalarin araç kimligi ve diger komponentlerle uyumunu saglamak, Tasarimini yaptigi parçalarin 3D yüzey datalarini çikarir A yüzeylerin (disaridan görünen yüzeyler) kenar büküm ve radyüslerini yaparak mühendislik çalismalarini yapmak üzere ilgili bölümlere göndermek, Iç ve dis parçalarin tasarim faaliyetlerini maliyet üretilebilirlik hafiflik montaj servis edilebilirlik ve malzeme uygunlugu konusunda iletilen isterleri de dikkate alarak yapmak süreç dahilinde ilgili bölümlerle birlikte çalismalarini yürütmek geri bildirimlere göre revizyonlari yapmak tasarimlarini maksimum ortak parça kullanimini göz önünde bulundurarak sekillendirmek, Yeni ve türev araçlarin iç ve dis renklerinin uyum çalismasini doku boya renk kumas ve desen seçimlerini yapmak araç boya maskelemelerinin tarifini hazirlamak, Araçlarin iç ve dis renklerini uyumlu bir sekilde belirlemek için fotorealistik görüntülerini alarak görsel sunumlar hazirlamak render ve animasyon çalismalarini yapmak iç ve dis etiketler folyo dis giydirme yazi ve desenlerin grafik çalismalarini yapmak, Styling çalismalari yapilip onayi alinan araç dis görseli soför mahali tavan yapisi vb parçalarin mock-up hazirliklarini yapmak prototip araçlar üzerinde dogrulamasini gerçeklestirmek soför bölgesi tasarim çalismalarini genel ergonomi gerekleri iletilen genel veya lokal regülasyon sartlari ve VDV gibi özel talepleri dikkate alarak gerçeklestirmek, Yeni ve türev araçlar ile ihale araçlarinin ölçekli maketlerini yapmak / yaptirmak, Yeni tanimlanmasi gereken etiket ve ekran gibi bilgilendirici içeriklerin grafik çalismasini yapmak araç üzerinde prototip dogrulama faaliyetlerini gerçeklestirmek, Özel araç projelerinde araç iç ve dis tasarimini malzeme ve komponent seçimini üst yapici firma ile birlikte çalismak, Endüstriyel tasarim tescil basvurusu için gerekli dokümanlari hazirlamak ve sürece destek vermek, Çevik çalisma metodolojisinin gerekliliklerinin (daily, sprint planlama, review vb.) yerine getirilmesini saglamak., "
006349;TIC. ARAÇLAR SISTEM MÜH. VE PLATFORM DIR;TIC. ARAÇLAR SISTEM MÜH. VE PLATFORM DIR;"Sorumlu oldugu araç gruplarinda müsteri/bayi taleplerinin araçlara uyarlanmasi araçlar için opsiyonlarin belirlenmesi ve tarifleri ihalelerde teknik sartnamenin incelenmesi ve sartnameye uygun hale getirilmesi karsilanamayan taleplere alternatif çözümler bulunulmasi homologasyon döküman ve bilgi destegi araçlarin mevzuatsal olarak güncelliginin saglanmasi baslica görevler arasinda yer almaktadir. ";"Türev araç siparislerinde taleplerin karsilanmasi için araç/opsiyon kodu belirlenmesi ve tarifleri APL ve model kontrolleri ile üretim uygunlugunun saglanmasi Ihale dokümanlarinda teknik sartnamenin incelenmesi araç belirlenmesi ve maliyet çalismalari için parça listesinin olusturulmasi ve doküman destegi. Araçlarin güncel mevzuatlara uygunlugunun saglanmasi. SSH sorunlarinin çözümlerinde destekler. Araç proje resimleri ve agirlik hesaplarinin hazirlanmasi. ";" edilir ise onaylar, • Yeni ve türev araç süreçlerinde homologasyon ihtiyaç gereksinimlerini homologasyon birimiyle birlikte belirler sürecin takibini ve koordinasyonunu saglar, • Homologasyon ihale ve seri üretim araçlarinin ilgili sistemlerine ait prototip araç üzerindeki testlerini yaptirimasini ve takibini saglar., • Homologasyon faaliyetleri için gerekli döküman hazirliklarini destekler ve teminini saglar., • Proje yönetiminden gelen taleplere göre ihaleler için gerekli teknik analizleri yapar sorulara cevap verir gerekli resim ve belgeleri olusturur veya teminini saglar., • Müsteri (fabrika içi veya disi) ve kullanicilardan gelen direkt veya endirekt taleplerin araçlara uygulanabilirligini degerlendirir., • Yayin asamasinin süreç adimlarinda ilgili tasarim onay sürecinden sonra PDM içinde kontrol ve onay rolü üstlenir, • Araçlarin agirlik hesaplamalarini yapar. Araç yasam döngüsü içinde agirlik kontrolünü CAD data üzerinden gerçeklestirir ve fiziki araçlarla mukayeseli yönetimini yapar, • Araç sistemlerinin CAD productlarinin tasarim gözden geçirme ve çakisma kontrolleri routing kontrollerini yapar. CAD productlarin teknik sartname regülasyon ve direktiflere göre kontrolünü gerçeklestirir uygunsuzluklar hakkinda tasarim ekiplerine bilgi verir. Tasarimi PDM ortaminda yapilmayan araçlarda cad product olusturur ve product yönetimini üstlenir. Ilgili TA mühendislik birimlerinin CAD tamamlama çalismalarini gözlemler ve eksiklikler için bilgi verir., • Yeni araç projeleri market arastirmalari ve edinilen bilgiye göre konsept olusturma faaliyetlerini yürütür., • Türev ve yeni araç opsiyon fonksiyonlarinin olusturulmasi ve iliski aginin kurulmasini koordine eder., • Konsept araç speklerinin belirlenmesi gereksinim listelerinin olusturulmasi ve cad paketlemesini yapar yaptirir., • Yeni ve türev araç maliyet çalismalarinin yapilmasi için gerekli ürün agaci listelerini TA ekiplerine saglar., • Outsource proje yönetimini ve koordinasyonunu saglar, • Atölye araç prototip araç üretim faaliyetlerinin koordinasyonu ve çiktilarina göre aksiyon planlarini koordine eder., • Araç testleri ve validasyon testlerinin koordinasyonu ve çiktilarina göre aksiyon planlarini koordine eder., • Araç teknik özelliklerinin konfigürasyonunun belirlenmesini saglar spekleri hazirlar, • Türev araçlarda sistem ve komponentlerin araç ön paketleme ve yerlesim islerini zarf tanimlamalarini yapar, • Araç ve opsiyon isim ve kodlarinin belirlenmesini dökümantasyon birimiyle koordineli olarak çalisma klasörlerinin olusturulmasi için koordineyi saglar, • Proje yönetiminden gelen ihale dökümanlari teknik sartname incelemelerinin gereksinim yönetimini yapar, • Müsteri ihtiyaçlari ve araç gereksinimlerini ilgili satis departmanlarinin ve TA Proje ve Kaynak Yönetimi Müdürlügü’nden iletilen bilgiler ile belirler, • Satis/Pazarlama birimlerinden iç müsteriden veya TA Proje ve Kaynak Yönetimi Müdürlügün’den gelen yeni araç taleplerinin teknik ön degerlendirmesini yapar. Ihtiyaç duydugu teknik konularda mühendislik ekiplerinden görüs alip teknik olarak UYGUN veya RET karari verir. Uygunluk alan projeler için ilgili bölümler ile koordinasyonu saglar., • TA Proje ve Kaynak Yönetimi Müdürlügü’nden gelen türev araç taleplerinin teknik ön degerlendirmesini yapar, • Türev araç projelerinde Proje yönetimi araciligi ile gelen Satis pazarlama müsteri bayi vb teknik destek ihtiyaçlarini karsilar, • Satis pazarlama birimlerinin hazirladigi ve benzeri teknik dokümanlari inceler ve talep edilir ise onaylar, • Yeni ve türev araç süreçlerinde homologasyon ihtiyaç gereksinimlerini homologasyon birimiyle birlikte belirler sürecin takibini ve koordinasyonunu saglar, • Homologasyon ihale ve seri üretim araçlarinin ilgili sistemlerine ait prototip araç üzerindeki testlerini yaptirimasini ve takibini saglar., • Homologasyon faaliyetleri için gerekli döküman hazirliklarini destekler ve teminini saglar., • Proje yönetiminden gelen taleplere göre ihaleler için gerekli teknik analizleri yapar sorulara cevap verir gerekli resim ve belgeleri olusturur veya teminini saglar., • Müsteri (fabrika içi veya disi) ve kullanicilardan gelen direkt veya endirekt taleplerin araçlara uygulanabilirligini degerlendirir., • Yayin asamasinin süreç adimlarinda ilgili tasarim onay sürecinden sonra PDM içinde kontrol ve onay rolü üstlenir, • Araçlarin agirlik hesaplamalarini yapar. Araç yasam döngüsü içinde agirlik kontrolünü CAD data üzerinden gerçeklestirir ve fiziki araçlarla mukayeseli yönetimini yapar, • Araç sistemlerinin CAD productlarinin tasarim gözden geçirme ve çakisma kontrolleri routing kontrollerini yapar. CAD productlarin teknik sartname regülasyon ve direktiflere göre kontrolünü gerçeklestirir uygunsuzluklar hakkinda tasarim ekiplerine bilgi verir. Tasarimi PDM ortaminda yapilmayan araçlarda cad product olusturur ve product yönetimini üstlenir. Ilgili TA mühendislik birimlerinin CAD tamamlama çalismalarini gözlemler ve eksiklikler için bilgi verir., • Yeni araç projeleri market arastirmalari ve edinilen bilgiye göre konsept olusturma faaliyetlerini yürütür., • Türev ve yeni araç opsiyon fonksiyonlarinin olusturulmasi ve iliski aginin kurulmasini koordine eder., • Konsept araç speklerinin belirlenmesi gereksinim listelerinin olusturulmasi ve cad paketlemesini yapar yaptirir., • Yeni ve türev araç maliyet çalismalarinin yapilmasi için gerekli ürün agaci listelerini TA ekiplerine saglar., • Outsource proje yönetimini ve koordinasyonunu saglar, • Atölye araç prototip araç üretim faaliyetlerinin koordinasyonu ve çiktilarina göre aksiyon planlarini koordine eder., • Araç testleri ve validasyon testlerinin koordinasyonu ve çiktilarina göre aksiyon planlarini koordine eder., Çevik çalisma metodolojisinin gerekliliklerinin (daily, sprint planlama, review vb.) yerine getirilmesini saglamak., "
